|Tue Dec 23 16:44:49 +0000 2014|;|0|;|retrospectiva na AT_USER alem de ser a copa do mundo foi também a copa das redes sociais twitter da zueira na copaquem lembra|
|Tue Dec 23 16:41:38 +0000 2014|;|1|;|rt AT_USER clima de copa do mundo foi bom demais neh 😍 quem viveu viveuquem ficou de mimimi perseu o maior espetaculo da terra|
|Tue Dec 23 16:41:12 +0000 2014|;|33|;|rt AT_USER tenho certeza que se bruno não fosse preso estaria nessa copa do mundo de 2014 um excelente goleiro URL|
|Tue Dec 23 16:40:12 +0000 2014|;|1|;|clima de copa do mundo foi bom demais neh 😍 quem viveu viveuquem ficou de mimimi perseu o maior espetaculo da terra|
|Tue Dec 23 16:39:02 +0000 2014|;|244|;|rt AT_USER se o brasil realizasse a copa do mundo do surf as ondas seriam superfaturadas|
|Tue Dec 23 16:38:00 +0000 2014|;|0|;|para dunga neymar é referência no brasil esportefutebolcopamundo URL URL|
|Tue Dec 23 16:37:13 +0000 2014|;|5|;|rt AT_USER povo gosta de aparecer fizeram manifestações só em época de copa do mundo passou ela passou tudo|
|Tue Dec 23 16:36:29 +0000 2014|;|0|;|a retrospectiva 2014 terá alguns minutos extras por causa de brasil x alemanha na copa do mundo|
|Tue Dec 23 16:36:17 +0000 2014|;|2|;|rt AT_USER jabor na copa do mundo o br vai mostrar ao mundo a sua incompetência em 2015 o br vai explodir sim pioramos …|
|Tue Dec 23 16:36:13 +0000 2014|;|0|;|na copa do mundo mostramos que sabemos tratar os gringos bem demais sobretudo os alemães|
|Tue Dec 23 16:31:16 +0000 2014|;|0|;|poorra tá mais fácil chegar a copa do mundo na russia do que 2015 mano veem 2015  — se sentindo animado|
|Tue Dec 23 16:30:56 +0000 2014|;|2|;|jabor na copa do mundo o br vai mostrar ao mundo a sua incompetência em 2015 o br vai explodir sim pioramos no quesito mãe dinah|
|Tue Dec 23 16:30:05 +0000 2014|;|0|;|URL » [espanhol para iniciantes] – (vídeo aula 38) - futebol e copa do mundo em espanhol|
|Tue Dec 23 16:29:37 +0000 2014|;|0|;|neymar elogie — ou cornete — o jogador URL boladaveja|
|Tue Dec 23 16:28:31 +0000 2014|;|0|;|agora no sportv sendo lembrada a copa do mundo 2014|
|Tue Dec 23 16:27:11 +0000 2014|;|0|;|melhores momentos da copa do mundo 2014 no brasil - globo URL via AT_USER|
|Tue Dec 23 16:26:20 +0000 2014|;|5|;|rt AT_USER naovaitercopa pra mim o maior fail de 2014falaram tantomas tanto que essa copa do mundo foi fodastica|
|Tue Dec 23 16:26:20 +0000 2014|;|422|;|rt AT_USER eu dou meu cu pra todo mundo do site se o brasil não ganhar essa copa pode me cobrar|
|Tue Dec 23 16:23:06 +0000 2014|;|0|;|AT_USER AT_USER quase certeza que trocam lembro que botavam doodles diários na copa do mundo|
|Tue Dec 23 16:22:45 +0000 2014|;|0|;|to mas oitavas da copa do mundo no fifa 14|
|Tue Dec 23 16:21:37 +0000 2014|;|0|;|copa do mundo nunca ouvi nao|
|Tue Dec 23 16:19:26 +0000 2014|;|0|;|olha dilma quero a proxima copa do mundo aqui ta valeu|
|Tue Dec 23 16:19:21 +0000 2014|;|5|;|naovaitercopa pra mim o maior fail de 2014falaram tantomas tanto que essa copa do mundo foi fodastica|
|Tue Dec 23 16:19:07 +0000 2014|;|0|;|essa musica é tão copa do mundo sdds copa q o brasil cagou|
|Tue Dec 23 16:17:01 +0000 2014|;|0|;|dps q eu ganha a copa do mundo de 2018 kk|
|Tue Dec 23 16:16:59 +0000 2014|;|33|;|tenho certeza que se bruno não fosse preso estaria nessa copa do mundo de 2014 um excelente goleiro URL|
|Tue Dec 23 16:15:15 +0000 2014|;|0|;|é uma audácia a fifa me mandar email perguntando se eu gostei da copa do mundo --|
|Tue Dec 23 16:15:05 +0000 2014|;|0|;|para além dos estádios a copa do mundo fifa de futebol bateu recordes também nas redes sociais URL|
|Tue Dec 23 16:12:07 +0000 2014|;|5|;|povo gosta de aparecer fizeram manifestações só em época de copa do mundo passou ela passou tudo|
|Tue Dec 23 16:10:07 +0000 2014|;|0|;|hoje é aniversário do goleiro bruno em entrevista seu advogado disse que o eterno ídolo do fla disputará a copa URL|
|Tue Dec 23 16:09:05 +0000 2014|;|0|;|destaque dos eua na copa do mundo yedlin assina com tottenham lateral-direito tinha acord URL - via foxsportsbr|
|Tue Dec 23 16:08:14 +0000 2014|;|0|;|qm quiser assistir o jogo entre alemanha e basil de novo completo ta ai URL|
|Tue Dec 23 16:03:50 +0000 2014|;|0|;|AT_USER bbxksbzjx foi amor a primeira cobertura de copa do mundo|
|Tue Dec 23 15:56:57 +0000 2014|;|0|;|coisas que marcaram 2014 copa do mundo férias de 1 mês odiar a sara madeira show do paralamas do sucesso|
|Tue Dec 23 15:55:45 +0000 2014|;|14|;|rt AT_USER qual foi o momento + ou - da copa do mundo a gente fica com o nome do craque sul-coreano k h lee foxparatodos|
|Tue Dec 23 15:50:51 +0000 2014|;|0|;|campeão da copa do mundo com a seleção da índia fazer a seleção de vanuatu a melhor da oceania (ñ consegui por pouco)|
|Tue Dec 23 15:50:23 +0000 2014|;|0|;|veja retrospectiva os acertos e as bizarrices da copa do mundo no brasil retrospectiva os acertos e as  URL|
|Tue Dec 23 15:48:28 +0000 2014|;|0|;|meu filho acorda o que vale mesmo é copa do mundo e olímpiadas o resto é resto|
|Tue Dec 23 15:46:31 +0000 2014|;|0|;|brasil nunca mais vai ganhar uma copa do mundo|
|Tue Dec 23 15:46:24 +0000 2014|;|0|;|gostei de um vídeo AT_USER de AT_USER URL separados no nascimento 4 - agora é tarde - copa do mundo|
|Tue Dec 23 15:43:42 +0000 2014|;|0|;|sdds copa do mundo bares jogadores da holanda|
|Tue Dec 23 15:43:09 +0000 2014|;|0|;|gata me chama de copa do mundo e investe em mim d|
|Tue Dec 23 15:38:47 +0000 2014|;|0|;|indo ali com o papai ganhar a copa do mundo AT_USER 7x1 fotosdofutebol URL|
|Tue Dec 23 15:38:28 +0000 2014|;|0|;|retrospectiva os acertos e as bizarrices da copa do mundo no brasil a abertura do mundial teve apresenta URL|
|Tue Dec 23 15:34:23 +0000 2014|;|0|;|mineirão foi uma das sedes da copa do mundo de 2014 no brasil tem capacidade p 70 mil pessoas URL|
|Tue Dec 23 15:32:59 +0000 2014|;|0|;|AT_USER AT_USER torres 30 anos e 256 gols guerrero 30 anos e 176 gols torres 1 copa do mundo e guerrero 1 mundial de clubes|
|Tue Dec 23 15:26:41 +0000 2014|;|0|;|gostei de um vídeo AT_USER URL 2 x 0 alemanha - jogo completo - final da copa do mundo de 2002 - jogos|
|Tue Dec 23 15:21:49 +0000 2014|;|1|;|rt AT_USER copa do mundo e vaias o planalto chegou a anunciar que dilma não iria à abertura da copa do mundo no dia 12 URL|
|Tue Dec 23 15:20:25 +0000 2014|;|0|;|tá passando ao vivo gente portugal x eua na copa do mundo ao vivo tá 1x0 portugal|
|Tue Dec 23 15:18:55 +0000 2014|;|1|;|rt AT_USER só de ter sido ano de copa do mundo não tenho o q reclamar de 2014|
|Tue Dec 23 15:18:44 +0000 2014|;|0|;|esses dias tava tendo copa do mundo 7x1 e agora plau janeiro já ta quase ai|
|Tue Dec 23 15:18:25 +0000 2014|;|0|;|passando estados unidos x portugal da copa do mundo e só sinto saudades|
|Tue Dec 23 15:16:59 +0000 2014|;|0|;|AT_USER gata me chama de copa do mundo e investe em mim|
|Tue Dec 23 15:16:58 +0000 2014|;|1|;|só de ter sido ano de copa do mundo não tenho o q reclamar de 2014|
|Tue Dec 23 15:11:46 +0000 2014|;|0|;|veja os melhores e os piores do telejornalismo de 2014 em um ano de copa do mundo e… URL|
|Tue Dec 23 15:09:17 +0000 2014|;|0|;|se o brasil realizasse a copa do mundo do surf as ondas seriam superfaturadas (ricardo amorim)|
|Tue Dec 23 15:08:04 +0000 2014|;|0|;|a copa do mundo 2014 recebeu mais de 30 mil muçulmanos entre comitivas atletas e membros da organização URL|
|Tue Dec 23 15:06:12 +0000 2014|;|0|;|“AT_USER seleção trabalhará para ajudar neymar a ser o melhor jogador do mundo diz dunga  novamente já perdeu olimpiadas copa|
|Tue Dec 23 15:05:10 +0000 2014|;|0|;|só lembrando fui pra casa do irmão AT_USER  jogamos fifa copa do mundo 2014 11 partidas patrik 6 x 5 antônio patinho kk|
|Tue Dec 23 15:03:30 +0000 2014|;|0|;|esse ano teve copa do mundo poxa e eu fui num estádio de futebol pela primeira vez na vida (não devido a copa mas as coisas tem haver)|
|Tue Dec 23 14:59:08 +0000 2014|;|0|;|melhor cara de ânus a da presidene da relublica federativa do brasil entregando a copa do mundo pra seleção da alemanha|
|Tue Dec 23 14:58:15 +0000 2014|;|0|;|estádio da copa do mundo vira palco de corrida de rua no cross urbano|
|Tue Dec 23 14:57:18 +0000 2014|;|0|;|estádio da copa do mundo vira palco de corrida de rua no cross urbano URL|
|Tue Dec 23 14:50:33 +0000 2014|;|976|;|rt AT_USER faltam 29 dias para eu realizar meu sonho de representar meu povo em uma copa do mundo|
|Tue Dec 23 14:49:34 +0000 2014|;|6|;|rt AT_USER campeão gabriel medina vence copa do mundo de hang loose|
|Tue Dec 23 14:49:30 +0000 2014|;|0|;|portalbrasil jovane guissone fatura duas medalhas na copa do mundo de hong kong URL|
|Tue Dec 23 14:47:51 +0000 2014|;|1526|;|rt AT_USER é amanhã o primeiro passo da realização de um sonhorepresentar meu povo em uma copa do mundo chegou a hora brasil http…|
|Tue Dec 23 14:47:38 +0000 2014|;|2|;|rt AT_USER 2014 de a a z c - copa do mundo URL URL|
|Tue Dec 23 14:47:12 +0000 2014|;|0|;|estádio da copa do mundo vira palco de corrida de rua no cross urbano depois de passagens por brasília e reci URL|
|Tue Dec 23 14:46:30 +0000 2014|;|229|;|rt AT_USER mario gotze preferia eu ter me lesionado não ele reus merecia muito disputar essa copa do mundo URL|
|Tue Dec 23 14:46:10 +0000 2014|;|0|;|notícias  estádio da copa do mundo vira palco de corrida de rua no cross urbano URL tocaepassa|
|Tue Dec 23 14:42:58 +0000 2014|;|1|;|rt AT_USER momentostiomork depois veio uma coisa tão loscao um negocio chamado the fucking copa do mundo no brasil de 2014 meu jesus|
|Tue Dec 23 14:42:45 +0000 2014|;|0|;|blogueirosat o que será da cultura copa do mundo e eleições afetaram os investimentos em cultura no ano de  URL|
|Tue Dec 23 14:42:39 +0000 2014|;|1|;|momentostiomork depois veio uma coisa tão loscao um negocio chamado the fucking copa do mundo no brasil de 2014 meu jesus|
|Tue Dec 23 14:42:21 +0000 2014|;|0|;|2014 de a a z c - copa do mundo URL|
|Tue Dec 23 14:41:20 +0000 2014|;|0|;|como é difícil essa vida de brasileiro que vê a retrospectiva da copa do mundo 2014 quando gana empata com germanyalemanha|
|Tue Dec 23 14:38:54 +0000 2014|;|0|;|vendo reprise de jogos da copa do mundo|
|Tue Dec 23 14:37:50 +0000 2014|;|0|;|como assim ontem eu tava assistindo a copa do mundo e hoje já é natal|
|Tue Dec 23 14:34:04 +0000 2014|;|5|;|rt AT_USER operacaobetalab em ano de copa do mundo globo sobe cota de participação nos lucros de funcionários URL|
|Tue Dec 23 14:33:58 +0000 2014|;|1|;|rt AT_USER operacaoretwitar jovane guissone fatura duas medalhas na copa do mundo de hong kong esgrim URL …|
|Tue Dec 23 14:33:42 +0000 2014|;|4|;|rt AT_USER operacaobetalab em ano de copa do mundo globo sobe cota de participação nos lucros de funcionários URL s…|
|Tue Dec 23 14:32:09 +0000 2014|;|0|;|legado da copa do mundo rt AT_USER consumidor brasileiro desapareceu do comércio URL|
|Tue Dec 23 14:29:57 +0000 2014|;|0|;|rt e por isso não ganhamos a copa  tem que parar de jogar p neymar e jogar p time  ele não precisa de ajuda p ser melhor do mundo )|
|Tue Dec 23 14:27:53 +0000 2014|;|0|;|falou em gringoas menina ja fica com a ppk pegando fogolembro so da copa do mundo tinha gente quase morrendo por causa de uns gringos aaf|
|Tue Dec 23 14:27:39 +0000 2014|;|1|;|rt AT_USER 1anobdm roubando chinelo de gringo na copa do mundo e voltando p casa com um tamanho 45|
|Tue Dec 23 14:26:08 +0000 2014|;|1|;|1anobdm roubando chinelo de gringo na copa do mundo e voltando p casa com um tamanho 45|
|Tue Dec 23 14:25:15 +0000 2014|;|49|;|rt AT_USER projeto andar de novo e chute na copa do mundo entram na lista das 50 personalidade do ano do site americano verge ht…|
|Tue Dec 23 14:23:19 +0000 2014|;|0|;|retrospectiva2014 tvcarta copa 2014 horas antes da abertura da copa do mundo na quinta-feira 12 de junho a URL|
|Tue Dec 23 14:22:02 +0000 2014|;|0|;|jovane guissone fatura duas medalhas na copa do mundo de hong kong esgrimista brasileiro é bronze na espada b URL|
|Tue Dec 23 14:22:02 +0000 2014|;|0|;|(bra-gov) jovane guissone fatura duas medalhas na copa do mundo de hong kong esgrimista brasileiro é bronze  URL|
|Tue Dec 23 14:22:01 +0000 2014|;|1|;|operacaoretwitar jovane guissone fatura duas medalhas na copa do mundo de hong kong esgrim URL operacaoretwitar|
|Tue Dec 23 14:21:52 +0000 2014|;|1|;|rt AT_USER sdds copa do mundo|
|Tue Dec 23 14:19:41 +0000 2014|;|0|;|veja no AT_USER a matéria completa sobre a etapa da copa do mundo de patinação em pista curta URL|
|Tue Dec 23 14:19:15 +0000 2014|;|1|;|rt AT_USER veja a matéria completa sobre mais uma etapa da copa do mundo de patinação pista curta URL|
|Tue Dec 23 14:18:43 +0000 2014|;|1|;|veja a matéria completa sobre mais uma etapa da copa do mundo de patinação pista curta URL|
|Tue Dec 23 14:18:03 +0000 2014|;|2|;|2014 de a a z c - copa do mundo URL URL|
|Tue Dec 23 14:07:58 +0000 2014|;|0|;|francisswim - natação master circuito copa do mundo de águas abertas 2015 fina URL|
|Tue Dec 23 14:07:20 +0000 2014|;|0|;|kris tá parecendo aquele jogador da seleção brasileira que fez moicano e pintou o cabelo de cinza durante a copa do mundo euhein|
|Tue Dec 23 14:03:21 +0000 2014|;|14|;|rt AT_USER billabong pipe masters melhor que copa do mundo vai brasil parabéns medina 👏👏 URL|
|Tue Dec 23 14:00:45 +0000 2014|;|1|;|sdds copa do mundo|
|Tue Dec 23 14:00:22 +0000 2014|;|5|;|rt AT_USER fred na copa do mundo URL|
|Tue Dec 23 13:45:25 +0000 2014|;|0|;|se o brasil realizasse a copa do mundo do surf as ondas seriam superfaturadas via AT_USER|
|Tue Dec 23 13:45:19 +0000 2014|;|1|;|copa do mundo e vaias o planalto chegou a anunciar que dilma não iria à abertura da copa do mundo no dia 12 URL|
|Tue Dec 23 13:44:08 +0000 2014|;|3|;|rt AT_USER falaram tanto de copa do mundo que quando finalmente chegou eu já estava cansado dela|
|Tue Dec 23 13:43:56 +0000 2014|;|23|;|rt AT_USER sobre a abertura da copa do mundo no brasil foi como se eu estivesse esperando o show do metállica e aparecesse o mol…|
|Tue Dec 23 13:39:31 +0000 2014|;|0|;|como jogou bola gana contra a campeã do mundo copa do mundo é sensacional volta copa ooeeaa|
|Tue Dec 23 13:36:19 +0000 2014|;|0|;|por isso a globo defende tanto a máfia da cbf lucro com a copa salvou o ano na emissora dos marinhos URL|
|Tue Dec 23 13:34:50 +0000 2014|;|0|;|álbum de fotos melzex a liga - copa do mundo gringos nas ruas  0107 URL|
|Tue Dec 23 13:33:55 +0000 2014|;|1|;|rt AT_USER saudades copa do mundo|
|Tue Dec 23 13:33:47 +0000 2014|;|0|;|sobre van persie disse que a copa do mundo o atrapalhou mas que mas você pode vê-lo bem na segunda metade da temporada|
|Tue Dec 23 13:32:16 +0000 2014|;|0|;|fico lembrando que nunca mais vou ver uma copa do mundo no brasil puta qur pariu|
|Tue Dec 23 13:31:46 +0000 2014|;|0|;|reprise da copa do mundo |
|Tue Dec 23 13:31:11 +0000 2014|;|1|;|saudades copa do mundo|
|Tue Dec 23 13:29:55 +0000 2014|;|11|;|rt AT_USER goleiro bruno irá jogar a copa do mundo de 2014 diz advogado URL|
|Tue Dec 23 13:28:37 +0000 2014|;|35|;|rt AT_USER neuer reconhecimento pela copa do mundo todos nós já temos é a taça que ganhamos URL|
|Tue Dec 23 13:24:46 +0000 2014|;|0|;|gostei de um vídeo AT_USER URL holandesa invade salvador - copa do mundo 2014|
|Tue Dec 23 13:23:31 +0000 2014|;|1|;|rt AT_USER gente o que foi essa copa do mundo heim que mês que copa|
|Tue Dec 23 13:22:19 +0000 2014|;|0|;|queria uma copa do mundo semana q vem só pra eu poder passá-la com os amigos e não com os parentes|
|Tue Dec 23 13:21:01 +0000 2014|;|0|;|se o brasil realizasse a copa do mundo do surf as ondas seriam superfaturadas|
|Tue Dec 23 13:20:18 +0000 2014|;|5|;|fred na copa do mundo URL|
|Tue Dec 23 13:19:13 +0000 2014|;|1|;|gente o que foi essa copa do mundo heim que mês que copa|
|Tue Dec 23 13:19:09 +0000 2014|;|0|;|fifa™ mandando e mail pra ir à copa do mundo na rússia 2018™ obrigado pelo convite AT_USER|
|Tue Dec 23 13:15:30 +0000 2014|;|0|;|em pleno fim de ano passando jogo da copa do mundo na tv é muita falta do que passar mds|
|Tue Dec 23 13:10:18 +0000 2014|;|0|;|continue a jornada da copa do mundo da fifa™ inbox x centro de ingressos da fifa noreplyAT_USER via URL|
|Tue Dec 23 13:04:55 +0000 2014|;|0|;|e la vai eu pro meu lugar preferido do mundo o forum q ainda ta com decoracao da copa no natal|
|Tue Dec 23 13:00:00 +0000 2014|;|0|;|e assim foi 2014 no brasil de que você se orgulha neste ano do seu país roubo na copa do mundo roubo nas URL|
|Tue Dec 23 12:58:52 +0000 2014|;|1|;|rt AT_USER pra mim tinha que ter copa do mundo pelo menos umas 4 vezes no ano|
|Tue Dec 23 12:58:19 +0000 2014|;|1|;|pra mim tinha que ter copa do mundo pelo menos umas 4 vezes no ano|
|Tue Dec 23 12:57:48 +0000 2014|;|0|;|AT_USER quantas copa do mundo o zé roberto jogou em 2014|
|Tue Dec 23 12:57:43 +0000 2014|;|1|;|rt AT_USER sdds copa do mundo sdds|
|Tue Dec 23 12:56:24 +0000 2014|;|1|;|sdds copa do mundo sdds|
|Tue Dec 23 12:54:13 +0000 2014|;|0|;|apenas oito das 52 obras tocadas pela secretaria extraordinária da copa do mundo (secopamt) foram de fato concluídas pelo atual governo|
|Tue Dec 23 12:47:28 +0000 2014|;|0|;|porra é semana de natal ou de copa do mundo pra estarem com vunvuzela e buzinando que nem uns deficiente mental|
|Tue Dec 23 12:45:50 +0000 2014|;|1|;|rt AT_USER naquela semifinal da copa do mundo alemanha 7x1 brasil|
|Tue Dec 23 12:43:51 +0000 2014|;|0|;|seleção ajudará neymar e se tornar o melhor do mundo é migos podem esperar pela copa de 2022 porque essa a gente não ganha|
|Tue Dec 23 12:40:00 +0000 2014|;|1|;|rt AT_USER sexta feira vai ter reprise na globo copa do mundo 7x1 ah não|
|Tue Dec 23 12:37:44 +0000 2014|;|0|;|AT_USER é né mas o iniesta fez um gol que deu um título de copa do mundo|
|Tue Dec 23 12:35:58 +0000 2014|;|1|;|rt AT_USER a copa do mundo também salvou meu 2014 jajavskabsk|
|Tue Dec 23 12:34:56 +0000 2014|;|1|;|sexta feira vai ter reprise na globo copa do mundo 7x1 ah não|
|Tue Dec 23 12:33:05 +0000 2014|;|0|;|canteiros brasil copa do mundo seleção com arly barbosa no twitter b URL via AT_USER|
|Tue Dec 23 12:32:25 +0000 2014|;|2|;|rt AT_USER gols contusão copa do mundo e barcelona 2014 foi movimentado para neymar URL|
|Tue Dec 23 12:32:12 +0000 2014|;|0|;|coimbra ensaios e improvisos com arly barbosa na copa do mundo URL via AT_USER|
|Tue Dec 23 12:31:29 +0000 2014|;|0|;|a pobreza ensaios e improvisos com arly barbosa na copa do mundo URL via AT_USER|
|Tue Dec 23 12:31:14 +0000 2014|;|1|;|a copa do mundo também salvou meu 2014 jajavskabsk|
|Tue Dec 23 12:30:56 +0000 2014|;|0|;|joguem pra ganhar a copa seus porra AT_USER seleção trabalhará para ajudar neymar a ser o melhor do mundo URL|
|Tue Dec 23 12:30:03 +0000 2014|;|0|;|continue revivendo a copa do mundo da fifa brasil 2014 com a gente|
|Tue Dec 23 12:28:57 +0000 2014|;|0|;|a chuva cairá ensaios e improvisos com arly barbosa na copa do mundo URL via AT_USER|
|Tue Dec 23 12:28:57 +0000 2014|;|1|;|rt AT_USER saudades copa do mundo URL|
|Tue Dec 23 12:28:07 +0000 2014|;|0|;|eu desejo  volte copa do mundo 2014|
|Tue Dec 23 12:27:53 +0000 2014|;|0|;|improvisos e ensaios com arly barbosa na copa do mundo seleções ypacaray URL via AT_USER|
|Tue Dec 23 12:26:08 +0000 2014|;|0|;|fodão de 2014 copa do mundo do brasil danifarcawards2014 dfa14|
|Tue Dec 23 12:25:19 +0000 2014|;|0|;|dfa14 indicados ao prêmio chespirito fodão do ano - copa do mundo - eva green - gta v - robert rodriguez - romulo mendonça|
|Tue Dec 23 12:24:29 +0000 2014|;|0|;|gols contusão copa do mundo e barcelona 2014 foi movimentado para neymar URL|
|Tue Dec 23 12:22:28 +0000 2014|;|0|;|ternura improvisos e ensaios com arly barbosa na copa do mundo seleções URL via AT_USER|
|Tue Dec 23 12:19:46 +0000 2014|;|0|;|big up febrealema URL for your post  relembrando a copa do mundo no brasil 2014  alemanha vs brasil deutschland |
|Tue Dec 23 12:16:52 +0000 2014|;|0|;|copa do mundo maior evento do planeta oposição e mídia amiga destruíram o espírito da festa com campanhas baixo astral|
|Tue Dec 23 12:11:39 +0000 2014|;|0|;|melhor música oêa da copa do mundo URL danifarcawards2014|
|Tue Dec 23 12:07:11 +0000 2014|;|1|;|saudades copa do mundo URL|
|Tue Dec 23 11:51:21 +0000 2014|;|0|;|us$100 milhoes que a AT_USER deu ao brasil pela copa do mundo  ta no bolso de quem |
|Tue Dec 23 11:51:11 +0000 2014|;|0|;|23121989 morre aos 43 anos em sofia milko gaydarski zagueiro da bulgária na copa do mundo de 1970 URL|
|Tue Dec 23 11:29:06 +0000 2014|;|0|;|o grande mico de 2014 foi a campanha sórdida da mídia brasileira contra a copa do mundo do pt quebraram a cara de verde e amarelo AT_USER|
|Tue Dec 23 11:28:51 +0000 2014|;|0|;|2014 um ano para ser lembrado o ano de 2014 foi bastante atípico no brasil sediamos a copa do mundo de fute URL|
|Tue Dec 23 11:25:29 +0000 2014|;|224|;|rt AT_USER a cidade de lusail no qatar que será sede da final da copa do mundo de 2022 ainda não existe|
|Tue Dec 23 11:24:08 +0000 2014|;|0|;|23121954 nasce ohman chehaibi atacante da tunísia na copa do mundo de 1978 URL|
|Tue Dec 23 11:12:29 +0000 2014|;|0|;|as mais belas torcedoras da copa do mundo 2014 URL|
|Tue Dec 23 11:08:32 +0000 2014|;|0|;|AT_USER AT_USER até ir pra copa do mundo foi pelo sp parabéns por ter sido nosso artilheiro mas q ele cuspa menos|
|Tue Dec 23 10:55:21 +0000 2014|;|0|;|mais um legado da copa do mundo deixou para a futebol brasileiro  a cada minuto um gol da alemanha  h|
|Tue Dec 23 10:53:04 +0000 2014|;|3|;|rt AT_USER volta copa do mundo|
|Tue Dec 23 10:52:43 +0000 2014|;|0|;|AT_USER o meu foi em copa  barzinho com mpb é tudo de bom em copacabana é a oitava maravilha do mundo 😂😍|
|Tue Dec 23 10:42:22 +0000 2014|;|0|;|brazil gols contusão copa do mundo e barcelona 2014 foi movimentado para neymar URL|
|Tue Dec 23 10:34:24 +0000 2014|;|0|;|gostei de um vídeo AT_USER de AT_USER URL documentário copa do mundo|
|Tue Dec 23 10:31:21 +0000 2014|;|0|;|gols contusão copa do mundo e barcelona 2014 foi movimentado para neymar|
|Tue Dec 23 10:30:14 +0000 2014|;|0|;|gols contusão copa do mundo e barcelona 2014 foi movimentado para neymar URL - via espn|
|Tue Dec 23 10:19:06 +0000 2014|;|102|;|rt AT_USER 2014 no saite tuiter eu aprendi com vocês tudo sobre futebol (copa do mundo) política (eleições) e agora pra fechar co…|
|Tue Dec 23 10:15:21 +0000 2014|;|0|;|hits da copa tvs de plasma dão último suspiro no natal - campeãs de vendas durante a copa do mundo as tvs de pla URL|
|Tue Dec 23 10:14:47 +0000 2014|;|0|;|contra a alemanha na copa do mundo|
|Tue Dec 23 10:14:03 +0000 2014|;|0|;|AT_USER AT_USER AT_USER grêmio contanto os ptbs com uma comissão técnica de copa do mundo tem algo errado aí|
|Tue Dec 23 08:57:39 +0000 2014|;|11|;|rt AT_USER saudades daqueles dias de copa do mundo|
|Tue Dec 23 08:50:51 +0000 2014|;|0|;|circuito copa do mundo de águas abertas 2015 fina  caindo na água URL|
|Tue Dec 23 08:23:12 +0000 2014|;|0|;|top 3 momentos inesquecíveis da copa do mundo em flip-book URL|
|Tue Dec 23 08:22:59 +0000 2014|;|0|;|8 dias pra 2015 e eu aqui pensando que a copa do mundo foi semana passada|
|Tue Dec 23 08:07:50 +0000 2014|;|0|;|iih sdd disso tb huwhuwhwhwuwhw de ir p casa das amizades ver copa do mundo URL|
|Tue Dec 23 07:26:49 +0000 2014|;|52|;|rt AT_USER descrição gráfica da final da copa do mundo URL|
|Tue Dec 23 06:56:03 +0000 2014|;|0|;|que se foda o brasa vai se endividar e a divida da copa do mundo quem vai pagar|
|Tue Dec 23 06:37:04 +0000 2014|;|0|;|será que o negocio da copa do mundo funciona |
|Tue Dec 23 06:27:50 +0000 2014|;|0|;|todo feliz como um gol numa copa do mundo|
|Tue Dec 23 06:17:16 +0000 2014|;|1|;|rt AT_USER AT_USER AT_USER jugo neymar a copa do mundo URL|
|Tue Dec 23 05:46:59 +0000 2014|;|0|;|AT_USER tb penso a msm coisa agora que teve a copa do mundo eles n terão mais desculpas pq tem estádio brotando até do chão|
|Tue Dec 23 05:45:45 +0000 2014|;|0|;|AT_USER aqui o outro aqui não de problema vê se vai aí URL|
|Tue Dec 23 05:41:21 +0000 2014|;|11|;|goleiro bruno irá jogar a copa do mundo de 2014 diz advogado URL|
|Tue Dec 23 05:39:26 +0000 2014|;|5|;|rt AT_USER copa do mundo volta pra mim eu lhe imploro|
|Tue Dec 23 05:35:56 +0000 2014|;|2|;|rt AT_USER não ganhamos a copa do mundo mas o mundial do surf é nosso parabéns irmão gabriel medina deus seja louvado URL|
|Tue Dec 23 05:35:26 +0000 2014|;|32|;|rt AT_USER junho copa do mundo porraa oeaa provavelmente outro aviao sumiu morreu fernandão † http…|
|Tue Dec 23 05:31:01 +0000 2014|;|0|;|nossa a copa do mundo no br foi a coisa mais linda de todas espero estar viva pra ver a tercwira aqui|
|Tue Dec 23 05:28:00 +0000 2014|;|0|;|AT_USER a sofrência de iker bora URL|
|Tue Dec 23 05:26:31 +0000 2014|;|0|;|grande serra leoa campeã da copa do mundo fifa no modo online com uma vitória por 4-1 sobre a… URL|
|Tue Dec 23 05:17:58 +0000 2014|;|0|;|copa do mundo está tendo na AT_USER  continua tendo copa copadomundo vaitercopa|
|Tue Dec 23 05:16:22 +0000 2014|;|1|;|rt AT_USER alan tá fora da copa do mundo AT_USER AT_USER AT_USER|
|Tue Dec 23 05:12:58 +0000 2014|;|7|;|rt AT_USER pra nem uma copa do mundo salvar o ano é pq ele foi muito horroroso mesmo|
|Tue Dec 23 05:07:36 +0000 2014|;|0|;|na copa do mundo caio gente do céu|
|Tue Dec 23 04:57:35 +0000 2014|;|1|;|alan tá fora da copa do mundo AT_USER AT_USER AT_USER|
|Tue Dec 23 04:51:40 +0000 2014|;|0|;|AT_USER não ajsfl to vendo por link URL|
|Tue Dec 23 04:49:36 +0000 2014|;|0|;|AT_USER eu tbm preciso urgentemente de 2015 esquecer 2014 o fracasso da copa do mundo eleições escândalo da petrobrás etc|
|Tue Dec 23 04:47:10 +0000 2014|;|1|;|rt AT_USER esse ano eu aprendi que quem nao enfia toma na copa do mundo|
|Tue Dec 23 04:46:50 +0000 2014|;|1|;|esse ano eu aprendi que quem nao enfia toma na copa do mundo|
|Tue Dec 23 04:45:17 +0000 2014|;|0|;|2ª vc faz a melhor copa do mundo na sua casa e prepara o buffet pro visitante comer e meter 7 a 1 na semifinal|
