|Mon Dec 22 02:34:24 +0000 2014|;|0|;|lembro na copa do mundo tl toda era do fandom do david agr q acabou copa tudo sumiram ne ridiculas|
|Mon Dec 22 02:34:01 +0000 2014|;|0|;|obrigado bb copa do mundo e eleições|
|Mon Dec 22 02:27:33 +0000 2014|;|30|;|rt AT_USER retrospectiva de 2014 pra mim se resume em one direction no brasil e copa do mundo|
|Mon Dec 22 02:25:58 +0000 2014|;|3|;|rt AT_USER eu passaria pela humilhação do 7x1 de novo numa boa só pra ter a copa de volta volta copa do mundo 2014|
|Mon Dec 22 02:25:21 +0000 2014|;|1|;|rt AT_USER retrôgaby2014 em 2014 tive o prazer de fazer um trabalho phoda com o monoblocohino oficial da copa do mundo URL|
|Mon Dec 22 02:25:07 +0000 2014|;|3|;|eu passaria pela humilhação do 7x1 de novo numa boa só pra ter a copa de volta volta copa do mundo 2014|
|Mon Dec 22 02:19:44 +0000 2014|;|0|;|triste verdade AT_USER se o brasil realizasse a copa do mundo do surf as ondas seriam superfaturadas|
|Mon Dec 22 02:19:30 +0000 2014|;|0|;|gente melhor momento de 2014 foi a copa do mundo depois anaconda|
|Mon Dec 22 02:15:28 +0000 2014|;|0|;|vendo vlogs caue moura copa do mundo robalhera|
|Mon Dec 22 02:13:19 +0000 2014|;|0|;|fox sport passando o vt da argentina e irã da copa do mundo |
|Mon Dec 22 02:10:11 +0000 2014|;|0|;|AT_USER uma oportunidade única em uma copa do mundo bate uma tristeza ( (|
|Mon Dec 22 02:08:53 +0000 2014|;|1|;|rt AT_USER AT_USER porra nunca mais ouvi falar dele  passou a copa do mundo ele sumiu não ouvi mais falar|
|Mon Dec 22 02:08:36 +0000 2014|;|0|;|AT_USER imagina uma estátua do ronaldo fenômeno na copa do mundo de 98 😂😂 worldcup|
|Mon Dec 22 02:08:31 +0000 2014|;|1|;|AT_USER porra nunca mais ouvi falar dele  passou a copa do mundo ele sumiu não ouvi mais falar|
|Mon Dec 22 02:08:13 +0000 2014|;|0|;|se o brasil realizasse a copa do mundo de surf as ondas seriam superfaturadas|
|Mon Dec 22 02:07:45 +0000 2014|;|1|;|rt AT_USER dia da copa do mundo que recebi 400 e alguma coisa de rt quem tinha retweetado lineker dos santos elpes|
|Mon Dec 22 02:07:21 +0000 2014|;|1|;|rt AT_USER saudades da copa do mundo o evento reuniu muitas pessoas aqui nesse twitter saudades ficaram|
|Mon Dec 22 02:06:06 +0000 2014|;|1|;|saudades da copa do mundo o evento reuniu muitas pessoas aqui nesse twitter saudades ficaram|
|Mon Dec 22 02:04:50 +0000 2014|;|0|;|todo contente como um gol numa copa do mundo no fim do segundo tempo da prorrogação|
|Mon Dec 22 02:03:31 +0000 2014|;|11|;|rt AT_USER a copa do mundo no brasil não será bem sucedida|
|Mon Dec 22 01:59:47 +0000 2014|;|1|;|dia da copa do mundo que recebi 400 e alguma coisa de rt quem tinha retweetado lineker dos santos elpes|
|Mon Dec 22 01:59:44 +0000 2014|;|57|;|rt AT_USER khedira em 2014 - copa do mundo - champions - copa do rei - supercopa uefa - mundial de clubes - lena gercke URL|
|Mon Dec 22 01:55:50 +0000 2014|;|312|;|rt AT_USER alemanha irá ganhar a copa do mundo 2014|
|Mon Dec 22 01:55:32 +0000 2014|;|36|;|rt AT_USER casillas é o 1° capitão que ganha ucl la liga copa do rei supercopa supercopa uefa mundial eurocopa copa do mundo URL|
|Mon Dec 22 01:54:46 +0000 2014|;|0|;|após copa do mundo neymar afirma ter amadurecido em 2014 URL|
|Mon Dec 22 01:53:59 +0000 2014|;|0|;|o melhor desse ano foi a copa do mundo|
|Mon Dec 22 01:51:24 +0000 2014|;|0|;|blog alerta seridó após copa do mundo neymar afirma ter amadurecido  URL|
|Mon Dec 22 01:50:31 +0000 2014|;|1|;|rt AT_USER testado deu cinco tapas na bunda das sedutorasum tapa pra cada copa do mundo do brasil testedefidelidade|
|Mon Dec 22 01:49:46 +0000 2014|;|1|;|testado deu cinco tapas na bunda das sedutorasum tapa pra cada copa do mundo do brasil testedefidelidade|
|Mon Dec 22 01:44:26 +0000 2014|;|43|;|rt AT_USER copa caixa vale mais que copa do mundo é campeão|
|Mon Dec 22 01:44:24 +0000 2014|;|0|;|AT_USER AT_USER tanto que quando conseguiram se organizar elas começaram á participar de copa do mundo (70)|
|Mon Dec 22 01:43:57 +0000 2014|;|1|;|rt AT_USER copa do mundo de esqui alpino - etapa de alta badia hirscher supremo no slalom gigante URL|
|Mon Dec 22 01:42:48 +0000 2014|;|0|;|na mesma noite eu vi na tv everton ribeiro + copa do mundo + tinga + olodum que noite|
|Mon Dec 22 01:42:15 +0000 2014|;|0|;|AT_USER mas dps tem copa do mundo dr vôlei dd|
|Mon Dec 22 01:41:58 +0000 2014|;|0|;|AT_USER AT_USER AT_USER AT_USER e aproveita falar com ele o que ele fez na copa do mundo 2014 no brasil ele está se achando|
|Mon Dec 22 01:37:57 +0000 2014|;|0|;|AT_USER sim incluive ganha até da final da copa do mundo né camila kk|
|Mon Dec 22 01:33:47 +0000 2014|;|0|;|AT_USER AT_USER ganhar copa do mundo nada né|
|Mon Dec 22 01:33:34 +0000 2014|;|0|;|sintesenoticias após copa do mundo neymar afirma ter amadurecido em 2014 URL URL|
|Mon Dec 22 01:33:25 +0000 2014|;|8|;|rt AT_USER rt AT_USER se o brasil realizasse a copa do mundo do surf as ondas seriam superfaturadas|
|Mon Dec 22 01:33:08 +0000 2014|;|0|;|que absurdo o crime organizado tomou conta do brasil e você indignado com os custos dos estádios da copa do mundo 😆|
|Mon Dec 22 01:32:21 +0000 2014|;|0|;|desculpa tava jogando a final da copa do mundo mas é um otário mesmo|
|Mon Dec 22 01:30:11 +0000 2014|;|1|;|copa do mundo de esqui alpino - etapa de alta badia hirscher supremo no slalom gigante URL|
|Mon Dec 22 01:20:42 +0000 2014|;|0|;|gente olha o q a falta do título da copa do mundo fezachei lindo o campeonato de surf mas g-zuuiis fantastico|
|Mon Dec 22 01:11:49 +0000 2014|;|0|;|eu não acredito que a foxsports não vai transmitir bélgica x estados unidos foi um dos melhores jogos da copa do mundo cara sério|
|Mon Dec 22 01:11:27 +0000 2014|;|0|;|ifaf suécia não sediará mais copa do mundo de futebol americano em 2015 - 11 jardas - URL|
|Mon Dec 22 01:09:43 +0000 2014|;|0|;|vendo coisas que gostaria de desver (griezmann chorando na copa do mundo)|
|Mon Dec 22 01:08:59 +0000 2014|;|0|;|e a fox sports 2 repetindo jogos da copa do mundo 2014 olhos enchendo de lágrimas que saudades|
|Mon Dec 22 01:07:21 +0000 2014|;|0|;|a fox sports 2 tá de parabéns por reprisar toda a copa do mundo 👌👏|
|Mon Dec 22 01:04:48 +0000 2014|;|0|;|refinaria abreu e lima custou mais que os 12 estádios da copa do mundo de 2014 URL|
|Mon Dec 22 01:04:16 +0000 2014|;|1|;|rt AT_USER elisabeth goergl ganha o super-g em val disere e leva uma roda de queijo enorme pra casa URL URL|
|Mon Dec 22 01:04:13 +0000 2014|;|0|;|vt suiça vs franca vt argentina vs irã porra fox sports valeu s2s2 olha a copa do mundo ai|
|Mon Dec 22 01:03:08 +0000 2014|;|0|;|o rt anterior é especialmente para vc que encheu o saco por causa de copa do mundo|
|Mon Dec 22 01:00:19 +0000 2014|;|1|;|elisabeth goergl ganha o super-g em val disere e leva uma roda de queijo enorme pra casa URL URL|
|Mon Dec 22 01:00:15 +0000 2014|;|0|;|que ideia brilhante reprisar a copa do mundo eu que briguei tanto por causa desse fox sports 2 hoje agradeço a existência deles p|
|Mon Dec 22 00:56:49 +0000 2014|;|3|;|rt AT_USER se eu botar meu sono em dia acordo na próxima copa do mundo|
|Mon Dec 22 00:55:00 +0000 2014|;|0|;|natal não o que se fala é sobre o petrolão 2014 ano condenado pela copa do mundo e pelo final do mensalão URL|
|Mon Dec 22 00:52:16 +0000 2014|;|0|;|o que você achou da copa do mundo de 2014 qual o gol que você mais gostou o que você achou da goleada sofrida pelo brasil|
|Mon Dec 22 00:48:02 +0000 2014|;|0|;|21121974 morre aos 66 anos théodore nouwens zagueiro da bélgica na copa do mundo de 1930|
|Mon Dec 22 00:44:26 +0000 2014|;|3|;|se eu botar meu sono em dia acordo na próxima copa do mundo|
|Mon Dec 22 00:42:39 +0000 2014|;|0|;|narração do charles fisher concorrendo a melhor do ano juntamente com momentos históricos como o gol da alemanha na final da copa do mundo|
|Mon Dec 22 00:38:33 +0000 2014|;|5|;|rt AT_USER cristiano ronaldo tem agora dois campeonatos que não se destaca copa do mundo 13 jogos  3 gols mundial de clubes…|
|Mon Dec 22 00:38:01 +0000 2014|;|0|;|papai noel não existe caralho fato o brasil vendeu a copa do mundo para a frança numa reunião entre joseph blatter joão havelan|
|Mon Dec 22 00:37:06 +0000 2014|;|0|;|acabei de resgatar isto no copa do mundo da fifa™ da ea sports™ usando o novo catálogo ea sports football club URL|
|Mon Dec 22 00:32:48 +0000 2014|;|0|;|AT_USER partiu comemorar copa do mundo URL|
|Mon Dec 22 00:29:05 +0000 2014|;|0|;|se o brasil realizasse a copa do mundo do surf as ondas seriam superfaturadas(ricardo amorim)|
|Mon Dec 22 00:21:07 +0000 2014|;|336|;|rt AT_USER ansioso pelo fim da copa e pela volta do maior campeonato do mundo o brasileirão|
|Mon Dec 22 00:16:44 +0000 2014|;|0|;|AT_USER time de vermelho x time de azul na copa do mundo eu acho de longe parece kk|
|Mon Dec 22 00:15:12 +0000 2014|;|0|;|AT_USER tem interesse em destaque belga na copa do mundo AT_USER de 23 anos é o alvo do clube inglês nesta janela de transferências|
|Mon Dec 22 00:14:00 +0000 2014|;|6|;|rt AT_USER brasil tomou 7 em casa na copa morreu um canidato a presidente de acidente aereo xuxa saiu da globo um goleiro concorrend…|
|Mon Dec 22 00:13:06 +0000 2014|;|0|;|piaui esse cara disse tudo e mais um pouco sobre o brasil e copa do mundo URL via AT_USER|
|Mon Dec 22 00:10:28 +0000 2014|;|0|;|rt AT_USER se o brasil realizasse a copa do mundo do surf as ondas seriam superfaturadas pt e pmdb com 60% e resto para bolsa surf|
|Mon Dec 22 00:09:51 +0000 2014|;|2|;|rt AT_USER se deus quiser vou estar lá e faço 🙏 rt AT_USER AT_USER marca um gol pra mim na final da copa do mundo d…|
|Mon Dec 22 00:08:48 +0000 2014|;|0|;|nunca vai ter outro torneio de futebol tão bom quanto foi a copa do mundo aqui no brasil|
|Mon Dec 22 00:07:54 +0000 2014|;|0|;|gostei de um vídeo AT_USER URL fx - copa do mundo 2014 - world cup 2014 fx|
|Mon Dec 22 00:07:30 +0000 2014|;|2|;|se deus quiser vou estar lá e faço 🙏 rt AT_USER AT_USER marca um gol pra mim na final da copa do mundo de 2018|
|Mon Dec 22 00:06:25 +0000 2014|;|5|;|cristiano ronaldo tem agora dois campeonatos que não se destaca copa do mundo 13 jogos  3 gols mundial de clubes 4 jogos  1 gol|
|Mon Dec 22 00:05:56 +0000 2014|;|0|;|será que o AT_USER passará os 7 a 1 da copa do mundo naexpectativa|
|Sun Dec 21 23:59:53 +0000 2014|;|0|;|AT_USER marca um gol pra mim na final da copa do mundo de 2018|
|Sun Dec 21 23:56:35 +0000 2014|;|1|;|rt AT_USER o programa de hoje será sobre os campeonatos que aconteceram em 2014 pernambucano nordestão séries a e b e copa do …|
|Sun Dec 21 23:54:40 +0000 2014|;|1|;|rt AT_USER AT_USER se o brasil realizasse a copa do mundo do surf as ondas seriam superfaturadas|
|Sun Dec 21 23:54:03 +0000 2014|;|0|;|AT_USER foi zero a zero contra os euaa n sei de valores de prêmios sei que esse torneio é meio que preparatório p copa do mundo|
|Sun Dec 21 23:53:48 +0000 2014|;|0|;|“AT_USER após copa do mundo neymar afirma ter amadurecido em 2014 URL URL|
|Sun Dec 21 23:53:32 +0000 2014|;|6|;|brasil tomou 7 em casa na copa morreu um canidato a presidente de acidente aereo xuxa saiu da globo um goleiro concorrendo amelhor do mundo|
|Sun Dec 21 23:53:07 +0000 2014|;|0|;|copa do mundo fis hirscher garante quarta vitória na temporada canal outros esportes|
|Sun Dec 21 23:53:00 +0000 2014|;|0|;|copa do mundo fis vonn sofre mais um acidente em val disere canal outros esportes|
|Sun Dec 21 23:47:56 +0000 2014|;|0|;|2014 teve copa melhor coisa do mundo|
|Sun Dec 21 23:46:30 +0000 2014|;|0|;|a seleção feminina só ganha esses títulos mesmo chega copa do mundo e olimpíadas e essas meninas amarelam bonito marta inclusive|
|Sun Dec 21 23:42:35 +0000 2014|;|2|;|rt AT_USER shakira rainha da copa do mundo ate que enfim alguem falou algo certo|
|Sun Dec 21 23:40:25 +0000 2014|;|1|;|o programa de hoje será sobre os campeonatos que aconteceram em 2014 pernambucano nordestão séries a e b e copa do mundo|
|Sun Dec 21 23:40:20 +0000 2014|;|1|;|rt AT_USER rt maresias vive clima de copa do mundo após gabriel medina vencer o mundial de surfe URL g1 http…|
|Sun Dec 21 23:37:43 +0000 2014|;|0|;|emocionante — assistindo copa do mundo de snowboard|
|Sun Dec 21 23:35:13 +0000 2014|;|0|;|por que nesses top 100 de 2014 não tem a música da copa do mundo rs|
|Sun Dec 21 23:34:11 +0000 2014|;|0|;|AT_USER legal copa do mundo brasil otimo meu time quase serie b duro o ano inteiromuito bom|
|Sun Dec 21 23:32:50 +0000 2014|;|0|;|aqui vendo a copa do mundo de snowboard e sentindo uma invejinha branca da neve que tem la ((|
|Sun Dec 21 23:28:56 +0000 2014|;|0|;|davi luiz certeza que não irá esquecer o copa do mundo no brasil fantástico|
|Sun Dec 21 23:28:23 +0000 2014|;|3|;|rt AT_USER alá o david falando que teve a oportunidade de disputar uma copa do mundo|
|Sun Dec 21 23:28:15 +0000 2014|;|1|;|rt AT_USER tive o grande privilegio de participar de uma copa do mundo URL|
|Sun Dec 21 23:28:06 +0000 2014|;|1|;|rt AT_USER AT_USER ganharam o torneio internacional de brasília pela quinta vez mas é um torneio amistoso nunca ganhamos a copa do…|
|Sun Dec 21 23:27:19 +0000 2014|;|1|;|rt AT_USER o povo falando de personagem e david sempre humilde muito feliz em participar da copa do mundo|
|Sun Dec 21 23:26:33 +0000 2014|;|1|;|AT_USER ganharam o torneio internacional de brasília pela quinta vez mas é um torneio amistoso nunca ganhamos a copa do mundo feminina|
|Sun Dec 21 23:26:28 +0000 2014|;|0|;|tive a grande oportunidade de disputar uma copa do mundo david luiz|
|Sun Dec 21 23:26:23 +0000 2014|;|0|;|AT_USER não procede elas ganharam o quinto título em um torneio internacional que não é a copa do mundo a copa acontece no ano que vem|
|Sun Dec 21 23:26:14 +0000 2014|;|1|;|rt AT_USER tive o grande privilegio de disputar uma copa do mundo &lt33|
|Sun Dec 21 23:26:04 +0000 2014|;|1|;|o povo falando de personagem e david sempre humilde muito feliz em participar da copa do mundo|
|Sun Dec 21 23:25:57 +0000 2014|;|0|;|dupla identidade copa do mundo esse ano foi foda |
|Sun Dec 21 23:25:47 +0000 2014|;|3|;|alá o david falando que teve a oportunidade de disputar uma copa do mundo|
|Sun Dec 21 23:25:47 +0000 2014|;|1|;|tive o grande privilegio de disputar uma copa do mundo &lt33|
|Sun Dec 21 23:24:59 +0000 2014|;|0|;|“AT_USER se o brasil realizasse a copa do mundo do surf as ondas seriam superfaturadas” piada zona total 👏👏 igual o jornalista|
|Sun Dec 21 23:24:25 +0000 2014|;|0|;|AT_USER copa do mundo tão bom beber e lanches etc|
|Sun Dec 21 23:22:18 +0000 2014|;|0|;|tomei raiva de copa do mundo e paul|
|Sun Dec 21 23:22:13 +0000 2014|;|0|;|AT_USER ate ai cr7 fez nada na final da champions na copa do mundo toda e no mundial mas continua sendo o melhor do mundo|
|Sun Dec 21 23:21:22 +0000 2014|;|0|;|quem é o homem mais bonito do mundo na sua opinião — morzi ~~ (sdds copa) URL|
|Sun Dec 21 23:21:08 +0000 2014|;|0|;|sobre a copa do mundo de futebol feminino aguardando ansiosamente URL|
|Sun Dec 21 23:20:43 +0000 2014|;|0|;|AT_USER AT_USER so vamos acordar quando deixarmos de ir a uma copa do mundo|
|Sun Dec 21 23:19:48 +0000 2014|;|3|;|rt AT_USER a AT_USER é o segundo estádio mais usado após a copa do mundo veja URL URL AT_USER|
|Sun Dec 21 23:13:54 +0000 2014|;|0|;|meu celular é igual copa do mundo só recebe ligação de 4 em 4 anos 😂😂|
|Sun Dec 21 23:13:34 +0000 2014|;|0|;|argentina já pode mudar o nome pra vasco vice da copa do mundo e agora vice com o san lorenzo no mundial de clubes d|
|Sun Dec 21 23:13:01 +0000 2014|;|0|;|AT_USER aee próximo ano é a copa do mundo|
|Sun Dec 21 23:11:27 +0000 2014|;|0|;|precisamos de outra copa no brasil pra poder vaiar a AT_USER na frente do mundo inteiro|
|Sun Dec 21 23:10:52 +0000 2014|;|0|;|copa do mundo copa do mundo e as novinha assanha URL|
|Sun Dec 21 23:09:02 +0000 2014|;|0|;|“AT_USER após copa do mundo neymar afirma ter amadurecido em 2014 URL URL não sei que goiaba é essa|
|Sun Dec 21 23:07:08 +0000 2014|;|1|;|rt AT_USER parabéns meninas título mais que merecido e que venha a copa do mundo feminina 2015 que vai ser nossa étetra|
|Sun Dec 21 23:05:04 +0000 2014|;|25|;|após copa do mundo neymar afirma ter amadurecido em 2014 URL URL|
|Sun Dec 21 23:03:13 +0000 2014|;|0|;|manchester city tem interesse em destaque belga na copa do mundo kevin de bruyne de 23 an URL - via foxsportsbr|
|Sun Dec 21 23:02:42 +0000 2014|;|0|;|AT_USER ou seja fudeu na copa do mundo|
|Sun Dec 21 23:01:24 +0000 2014|;|0|;|AT_USER ele quer ser eleito o melhor do mundo de qualquer jeitoveja o seu desempenho na copa é brincadeira|
|Sun Dec 21 23:01:06 +0000 2014|;|0|;|a seleção brasileira feminina de futebol é campeã do torneio de brasília rumo a copa do mundo no canadá parabéns a mulherada|
|Sun Dec 21 23:00:09 +0000 2014|;|0|;|e que venha a copa do mundo de futebol feminino no canadá|
|Sun Dec 21 23:00:07 +0000 2014|;|0|;|copa do mundo de rouba-bandeira|
|Sun Dec 21 22:59:09 +0000 2014|;|0|;|copa do mundo q se dane o importante é ganhar a copa caixa é pentaa|
|Sun Dec 21 22:59:03 +0000 2014|;|1|;|parabéns meninas título mais que merecido e que venha a copa do mundo feminina 2015 que vai ser nossa étetra|
|Sun Dec 21 22:58:52 +0000 2014|;|0|;|pq o brasil joga com 5 estrelas no feminino se nunca ganhou copa do mundo|
|Sun Dec 21 22:58:19 +0000 2014|;|0|;|quem precisa de copa do mundo quando se tem copa caixa|
|Sun Dec 21 22:58:01 +0000 2014|;|3|;|rt AT_USER brasil campeão as meninas merecem demais e que venha a copa do mundo e olimpíadas 👏👏🙏💙💚💛🏆⚽️|
|Sun Dec 21 22:57:25 +0000 2014|;|0|;|AT_USER AT_USER esse capdevilla é aquele que esteve no copa do mundo 2010 com a espanha |
|Sun Dec 21 22:56:37 +0000 2014|;|0|;|aew ganhamo a copa do mundo|
|Sun Dec 21 22:56:14 +0000 2014|;|0|;|copa caixa a série c da copa do mundo fifa feminina serie b é a copa das confederações|
|Sun Dec 21 22:55:32 +0000 2014|;|1|;|rt AT_USER seleção brasileira é boa apesar dos pesares se tivesse um investimento digno já tinha ganho copa do mundo medalha de our…|
|Sun Dec 21 22:55:03 +0000 2014|;|0|;|AT_USER e o povo espanhol reclama dele por não ter feito gols na copa do mundo|
|Sun Dec 21 22:55:02 +0000 2014|;|1|;|seleção brasileira é boa apesar dos pesares se tivesse um investimento digno já tinha ganho copa do mundo medalha de ouro nas olimpíadas|
|Sun Dec 21 22:54:47 +0000 2014|;|0|;|tem que ganhar olimpíada e copa do mundo copa caixa não vale nada|
|Sun Dec 21 22:54:22 +0000 2014|;|1|;|rt AT_USER seleção feminina vai encarar eua na final em brasília esportefutebolcopamundo URL URL|
|Sun Dec 21 22:53:14 +0000 2014|;|0|;|AT_USER e chega na copa do mundo toma nabo se não for das americanas é das alemãs (que virão fortes)|
|Sun Dec 21 22:52:17 +0000 2014|;|3|;|brasil campeão as meninas merecem demais e que venha a copa do mundo e olimpíadas 👏👏🙏💙💚💛🏆⚽️|
|Sun Dec 21 22:51:56 +0000 2014|;|43|;|copa caixa vale mais que copa do mundo é campeão|
|Sun Dec 21 22:50:48 +0000 2014|;|40|;|rt AT_USER você não tá na copa do mundo mas tá batendo um bolão|
|Sun Dec 21 22:47:38 +0000 2014|;|0|;|e todo mundo ligado no jogo do brasil parecia copa do mundo|
|Sun Dec 21 22:45:12 +0000 2014|;|0|;|vale (bem) mais que uma copa do mundo o URL|
|Sun Dec 21 22:44:06 +0000 2014|;|0|;|vocês lembram da copa do mundo de 2011  eu chorei no jogo das quartas|
|Sun Dec 21 22:42:40 +0000 2014|;|0|;|batebolavocedecide chocolate mais humilhante da história mundial foi numa semi final de copa do mundo 1x7|
|Sun Dec 21 22:38:46 +0000 2014|;|3|;|rt AT_USER copa do mundo do qatar terá hotel de r$ 4 bilhões no mar URL|
|Sun Dec 21 22:38:36 +0000 2014|;|0|;|o brasil possui muita coisa boa mas política no nosso país é nossa vergonha como foi a copa do mundo de futebol1x7alemanhaprecisamos mudar|
|Sun Dec 21 22:37:19 +0000 2014|;|0|;|jogando aquele futebol no x-box versão copa do mundo comemorativa maneiro (@ bairro califórnia - nova iguaçu) URL|
|Sun Dec 21 22:35:17 +0000 2014|;|0|;|AT_USER ano q vem tem copa do mundo do fut feminino|
|Sun Dec 21 22:34:03 +0000 2014|;|0|;|e viva a copa do mundo 2014 URL|
|Sun Dec 21 22:29:55 +0000 2014|;|0|;|programa contraponto sobre a copa do mundo do brasil URL via AT_USER|
|Sun Dec 21 22:29:47 +0000 2014|;|0|;|vem copa do mundo kk URL|
|Sun Dec 21 22:29:09 +0000 2014|;|0|;|programa contraponto sobre a copa do mundo do brasil URL vía AT_USER|
|Sun Dec 21 22:27:45 +0000 2014|;|2|;|shakira rainha da copa do mundo ate que enfim alguem falou algo certo|
|Sun Dec 21 22:26:48 +0000 2014|;|4|;|rt AT_USER se o vasco não ganhar uma decisão do flamengo até a próxima copa do mundo vai completar 30 anos sem título em cima do mais qu…|
|Sun Dec 21 22:25:55 +0000 2014|;|0|;|josé luiz quadros de magalhães 1482- programa contraponto a copa do mundo no bra URL|
|Sun Dec 21 22:23:26 +0000 2014|;|0|;|sorriso lindoé nosso URL|
|Sun Dec 21 22:19:36 +0000 2014|;|0|;|para quem não viu ou quer rever entrevista do AT_USER ao esporte espetacular *-* URL|
|Sun Dec 21 22:17:30 +0000 2014|;|2|;|rt AT_USER domingo em casa com o filhão vendo o jogo do liverpool com a narração do amigo AT_USER companheiro de copa do mun…|
|Sun Dec 21 22:16:20 +0000 2014|;|0|;|contraponto copa do mundo no brasil URL vía AT_USER|
|Sun Dec 21 22:08:56 +0000 2014|;|0|;|após copa do mundo neymar afirma ter amadurecido em 2014 da folhapress o jogador neymar fez um balanço sobre URL|
|Sun Dec 21 22:05:25 +0000 2014|;|0|;|coloquem na band porque ta dando a final da copa do mundo de mulheres|
|Sun Dec 21 22:05:02 +0000 2014|;|0|;|esportes - após copa do mundo neymar afirma ter amadurecido leia mais URL URL|
|Sun Dec 21 22:02:19 +0000 2014|;|1|;|rt AT_USER após copa do mundo neymar afirma ter amadurecido em 2014 - URL URL|
|Sun Dec 21 22:00:40 +0000 2014|;|3|;|rt AT_USER argentina campeã da copa do mundo 2014 pode favoritar|
|Sun Dec 21 21:57:46 +0000 2014|;|3|;|rt AT_USER operacaobetalab após copa do mundo neymar afirma ter amadurecido em 2014 URL rt sdv|
|Sun Dec 21 21:56:58 +0000 2014|;|0|;|upload yes retrospectiva da copa do mundo brasil 1 x 7 alemanha e derrota em casa URL|
|Sun Dec 21 21:53:51 +0000 2014|;|0|;|tá vendo gol no campeonato italiano até o palacio faz quero ver na copa do mundo|
|Sun Dec 21 21:49:12 +0000 2014|;|0|;|AT_USER tu quer comparar torneio internacional com copa do mundo|
|Sun Dec 21 21:43:27 +0000 2014|;|6|;|rt AT_USER sdd copa do mundo menos o 7x1|
|Sun Dec 21 21:43:11 +0000 2014|;|0|;|essas jogadoras do brasil são muito guerreiras elas merecem ter reconhecimento e ganhar uma copa do mundo|
|Sun Dec 21 21:43:05 +0000 2014|;|0|;|tomara q quando tiver faltando 1 ano pra copa do mundo aconteça um atentado na rússia pra copa ser aqui no brasil denovo rsrsrsr sdds copa|
|Sun Dec 21 21:40:37 +0000 2014|;|6|;|rt AT_USER maresias vive clima de copa do mundo após título mundial de medina URL timbeta operacaobetalab …|
|Sun Dec 21 21:39:54 +0000 2014|;|0|;|2015 promete tanto como melhor ano que vai ter copa do mundo feminina e eu só to viva ate hj pra isso|
|Sun Dec 21 21:38:35 +0000 2014|;|110|;|rt AT_USER 2014 foi o ano de copa do mundo textão ebola textão eleição textão opinar sobre tudo reclamar do que nao sabe texto grande|
|Sun Dec 21 21:34:14 +0000 2014|;|1|;|após copa do mundo neymar afirma ter amadurecido em 2014 - URL URL|
|Sun Dec 21 21:33:28 +0000 2014|;|136|;|rt AT_USER você que torce para as seleções caras e cheia de estrelas continuarem desculpe mas você não entendeu a copa do mundo|
|Sun Dec 21 21:30:23 +0000 2014|;|0|;|o futebol não nos deu a copa do mundo os 7x1 foi o que eles nos deram aí num esporte individual pela 1ª vez o surf nos deu um campeão|
|Sun Dec 21 21:30:02 +0000 2014|;|1|;|rt AT_USER esse 😍 o da copa do mundo de 2011 inclusive tenho na versão amarela pq não tinha o roxo na loja da nike 😔 usavbra http…|
|Sun Dec 21 21:29:49 +0000 2014|;|1|;|rt AT_USER no banco da espanha da copa do mundo de 2014 nos temos olhos pretos  castanhos  azuis e verdes URL|
|Sun Dec 21 21:29:47 +0000 2014|;|0|;|AT_USER ata obrigada sera q na copa do mundo ela vai tá queria tanto ir lá assistir lá no canadá|
|Sun Dec 21 21:28:08 +0000 2014|;|2|;|rt AT_USER eu como profeta já digo hoje argentina campeã da copa do mundo 2014|
|Sun Dec 21 21:27:05 +0000 2014|;|1|;|esse 😍 o da copa do mundo de 2011 inclusive tenho na versão amarela pq não tinha o roxo na loja da nike 😔 usavbra URL|
|Sun Dec 21 21:21:52 +0000 2014|;|0|;|sair pegando a mulherada por ai qualquer com dinheiro pode mas ganhar a copa do mundo so jogando neymarnofaustao|
|Sun Dec 21 21:19:21 +0000 2014|;|2|;|rt AT_USER com duas arenas de copa do mundo ( a do grêmio arena só de campeonato gaúcho) por que jogar neste pasto plastificado tnc v…|
|Sun Dec 21 21:18:21 +0000 2014|;|0|;|e os melhores jogadores de copa do mundo ninguem pergunta eu acho q são os alemães neymarnofaustao|
|Sun Dec 21 21:17:57 +0000 2014|;|0|;|gostei de um vídeo AT_USER URL de hitler à declaração de ronaldo sobre copa do mundo|
|Sun Dec 21 21:15:26 +0000 2014|;|0|;|AT_USER AT_USER por que interamericana afroasiatica copa rio e pequena taça do mundo não são considerados mundiais|
|Sun Dec 21 21:03:30 +0000 2014|;|0|;|cheguei tomei um banho e agora to vendo a final da copa do mundo feminina|
|Sun Dec 21 21:03:16 +0000 2014|;|0|;|“prostituição na copa do mundo em natal é feita no pacote “sexo e forró por 30 reais” eu ainda morro de rir com isso dps da copa|
|Sun Dec 21 21:00:43 +0000 2014|;|0|;|tuvalu vence o vietnã e leva o título da 52ª copa do mundo marcílio dias URL|
|Sun Dec 21 20:59:07 +0000 2014|;|0|;|por que o estádio de brasília continua com a decoração da copa do mundo |
|Sun Dec 21 20:58:12 +0000 2014|;|0|;|sem contar q n bastava o tiago e o caio narrarem o jogo da copa do mundo descobri hj q eles narram o fifa 14 também n aguento maais|
