|Sun Dec 21 20:56:40 +0000 2014|;|2|;|apenas 4 dias e o clima para o natal está tão contagiante quanto o da copa do mundo parece uma vã tentativa de postergar a chegada de 2015|
|Sun Dec 21 20:55:55 +0000 2014|;|0|;|AT_USER lembrando q essa belezura vai ficar na AT_USER URL|
|Sun Dec 21 20:54:33 +0000 2014|;|0|;|expectativa  título da copa do mundo em casa realidade  gol da alemanha|
|Sun Dec 21 20:52:21 +0000 2014|;|0|;|que saudade da fase de grupos da copa do mundo 3 jogo por dia era mt legal|
|Sun Dec 21 20:50:38 +0000 2014|;|0|;|a camiseta da seleção norte americana é realmente linda na copa do mundo também ganhou de todas|
|Sun Dec 21 20:49:56 +0000 2014|;|0|;|AT_USER ano que vem sera a copa do mundo feminino né|
|Sun Dec 21 20:49:11 +0000 2014|;|0|;|i liked a AT_USER video from AT_USER URL neymar - entrevista exclusiva ao fantástico após a copa do mundo -|
|Sun Dec 21 20:46:01 +0000 2014|;|1|;|rt AT_USER copa do mundoporra de 7x1 domingão|
|Sun Dec 21 20:43:18 +0000 2014|;|1|;|rt AT_USER argentina campeã da copa do mundo 2014 arg õ|
|Sun Dec 21 20:42:32 +0000 2014|;|3|;|rt AT_USER argentina campeã da copa do mundo 2014 🏆🏆|
|Sun Dec 21 20:42:04 +0000 2014|;|1|;|rt AT_USER argentina vai ser a campeã da copa do mundo 2014|
|Sun Dec 21 20:41:39 +0000 2014|;|1|;|rt AT_USER vamos argentina  vamos messi  campeã da copa do mundo 2014|
|Sun Dec 21 20:40:04 +0000 2014|;|0|;|deveriam ter colocado o tardelli e o ronaldinho para jogar na copa do mundo mas colocaram o hulk e o fred zz|
|Sun Dec 21 20:39:07 +0000 2014|;|0|;|amo ela desde a copa do mundo de futebol feminino de 2011|
|Sun Dec 21 20:36:31 +0000 2014|;|1|;|copa do mundoporra de 7x1 domingão|
|Sun Dec 21 20:36:21 +0000 2014|;|0|;|nível de maturidade encomendando um livro de fotos temático copa do mundo com minhas fotos impressas|
|Sun Dec 21 20:35:17 +0000 2014|;|0|;|robben foi melhor jogador da copa do mundo|
|Sun Dec 21 20:34:00 +0000 2014|;|0|;|castelão teve média de r$ 24014450 a quinta pior entre os estádios que foram palco da copa do mundo URL|
|Sun Dec 21 20:33:38 +0000 2014|;|0|;|vamos olhar essa final da copa do mundo feminina então|
|Sun Dec 21 20:32:11 +0000 2014|;|0|;|veja no AT_USER todos os detalhes de mais uma copa do mundo de esqui alpino URL|
|Sun Dec 21 20:31:15 +0000 2014|;|0|;|21121909 nasce em gran canaria (espanha) pedro arico suárez meia da argentina na copa do mundo de 1930 URL|
|Sun Dec 21 20:31:12 +0000 2014|;|0|;|os dois se destacaram na etapa da copa do mundo de esqui alpino deste fim de semana URL|
|Sun Dec 21 20:28:57 +0000 2014|;|0|;|após copa do mundo neymar afirma ter amadurecido em 2014 o craque lamentou a pancada que sofreu de zuñiga d URL|
|Sun Dec 21 20:28:43 +0000 2014|;|0|;|operacaobetalab após copa do mundo neymar afirma ter amadurecido em 2014 o craque lamentou a  URL sdv timbeta|
|Sun Dec 21 20:28:03 +0000 2014|;|0|;| copa do mundo no brasil e o que ficou na memória foi a humilhação do 7x1 2014 foi o ano que nos ensinou a não subestimar o improvável|
|Sun Dec 21 20:27:50 +0000 2014|;|0|;|kroos entre 2013 e 2014 2 mundial de clubes 2 supercopa da uefa 1 ucl 1 copa do mundo 1 bundesliga 1 dfb-pokal URL|
|Sun Dec 21 20:26:42 +0000 2014|;|0|;|ouvindo la la la da shakira e pensando nos crushs da copa do mundo|
|Sun Dec 21 20:25:45 +0000 2014|;|0|;|esse ano foi a pior copa do mundo com toda a certeza|
|Sun Dec 21 20:23:36 +0000 2014|;|0|;|cara toda vez que o brasil joga com o eua eu relembro a copa do mundo de 2011|
|Sun Dec 21 20:22:10 +0000 2014|;|1|;|rt AT_USER AT_USER amarelo faz me lembrar borussia que faz me lembrar alemanha que faz me lembrar copa do mundo e que vc precisa se f…|
|Sun Dec 21 20:17:11 +0000 2014|;|0|;|21121954 nasce em campinas (sp) amaral zagueiro do brasil na copa do mundo de 1978 URL|
|Sun Dec 21 20:14:11 +0000 2014|;|2|;|rt AT_USER AT_USER AT_USER AT_USER tb achei q clau n tinha fãs só falo 2 coisas p qm ta falando dela billboard …|
|Sun Dec 21 20:13:07 +0000 2014|;|1|;|rt AT_USER a ultima vez em que a minha timeline estava tão animada sim era epoca de copa do mundo|
|Sun Dec 21 20:12:34 +0000 2014|;|2|;|AT_USER AT_USER AT_USER tb achei q clau n tinha fãs só falo 2 coisas p qm ta falando dela billboard e copa do mundo 🍭🌏|
|Sun Dec 21 20:12:32 +0000 2014|;|1|;|a ultima vez em que a minha timeline estava tão animada sim era epoca de copa do mundo|
|Sun Dec 21 20:06:33 +0000 2014|;|1|;|rt AT_USER uau depois de um ano muito especial conseguimos vencer a copa do mundo de clubes da fifa esta é para você madridistas +|
|Sun Dec 21 20:05:06 +0000 2014|;|0|;|copa do mundo 2014 - corinthians saudade maraca errejota alemanha france germany happy… URL|
|Sun Dec 21 19:58:39 +0000 2014|;|0|;|petiscos sudáveis para a copa do mundo URL fashion|
|Sun Dec 21 19:57:25 +0000 2014|;|0|;|a única coisa boa que aconteceu esse ano foi a copa do mundo|
|Sun Dec 21 19:56:58 +0000 2014|;|2|;|rt AT_USER o titulo foi comprado sim e se reclamar o paysandu compra a copa do mundo|
|Sun Dec 21 19:54:43 +0000 2014|;|0|;|AT_USER ai teve jg de copa do mundo esse ano a sorte é que não choveu se não ia fkr mal pro brasil kk copacaixa|
|Sun Dec 21 19:49:14 +0000 2014|;|0|;|AT_USER ++ esse ai foi ele q contratou pra cuidar dele após a copa do mundo|
|Sun Dec 21 19:47:51 +0000 2014|;|1|;|rt AT_USER é o ano não ta passandota voandoontem estava acontecendo a copa do mundo amanhã praticamente já é natal|
|Sun Dec 21 19:47:09 +0000 2014|;|1|;|rt AT_USER não sei se é domingo sábado sexta 2016 copa do mundo não sei to perdida|
|Sun Dec 21 19:45:12 +0000 2014|;|1|;|rt AT_USER AT_USER estadio de copa do mundo kk k|
|Sun Dec 21 19:44:30 +0000 2014|;|1|;|AT_USER estadio de copa do mundo kk k|
|Sun Dec 21 19:44:13 +0000 2014|;|1|;|é o ano não ta passandota voandoontem estava acontecendo a copa do mundo amanhã praticamente já é natal|
|Sun Dec 21 19:43:27 +0000 2014|;|0|;|aqui o link da entrevista do neymar que mostra o presente que o niall deu pra ele URL 1852|
|Sun Dec 21 19:43:24 +0000 2014|;|0|;|AT_USER AT_USER AT_USER pois é já uefa euro eles valorizam mas muito menos que a copa do mundo|
|Sun Dec 21 19:41:48 +0000 2014|;|1|;|não sei se é domingo sábado sexta 2016 copa do mundo não sei to perdida|
|Sun Dec 21 19:41:28 +0000 2014|;|0|;|AT_USER fazer festa é mole quero ver fazer gol na copa do mundo e nao dar vexame|
|Sun Dec 21 19:39:51 +0000 2014|;|0|;|tava vendo uns lances da copa do mundo 2010 sou só saudades )|
|Sun Dec 21 19:36:42 +0000 2014|;|0|;|méxico e camarões na copa do mundo teve uma chuva duca e o gramado da arena das dunas suportou drenagem muito boa|
|Sun Dec 21 19:35:16 +0000 2014|;|0|;|retrospectos 2014 enquanto a copa do mundo de futebol dominava a mídia por todos os lados 2 bandas atravessavam URL|
|Sun Dec 21 19:35:07 +0000 2014|;|0|;|esqueceram de perguntar pra fifa se alguma vez uma copa do mundo teve jgs adiados por causa de poças no gramado igual 4a copacaixa|
|Sun Dec 21 19:32:02 +0000 2014|;|0|;|kevin pauwels vence em namen 4ª etapa da copa do mundo por pró tour ciclismo foto uci o belga kevin URL|
|Sun Dec 21 19:30:41 +0000 2014|;|13|;|rt AT_USER chegou a hora acompanhe a batalha rumo ao hexa bra x ger ao vivo em URL globonacopa|
|Sun Dec 21 19:29:35 +0000 2014|;|0|;|argentinos olhando da torcida e pensando como uma arena lixo dessa sediou jgs de copa do mundo copacaixa|
|Sun Dec 21 19:28:30 +0000 2014|;|0|;|o que fizeram com o sistema de drenagem do mané garrincha nem parece que foi estádio de copa do mundo|
|Sun Dec 21 19:23:13 +0000 2014|;|0|;|único jg da copa do mundo com sol durante o jg inteiro na AT_USER foi argentina x suíça|
|Sun Dec 21 19:22:06 +0000 2014|;|0|;|em compensação na AT_USER durante a copa do mundo só teve 1 jg com sol teve poça não prq é arena de 1o mundo|
|Sun Dec 21 19:21:14 +0000 2014|;|7|;|rt AT_USER operacaobetalab após copa do mundo neymar afirma ter amadurecido em 2014 URL sdv rt|
|Sun Dec 21 19:18:07 +0000 2014|;|0|;|AT_USER pra mim antes era campeão da taça intercontinental hj da copa do mundo fifa são equivalentes n acho|
|Sun Dec 21 19:18:07 +0000 2014|;|0|;|a sorte é que não choveu na copa do mundo nem em bh nem em brasília já pensou q ridículo seria adiar um jg de copa por causa da chuva|
|Sun Dec 21 19:17:35 +0000 2014|;|1|;|rt AT_USER cara copa do mundo você foi a razão da minha felicidade máxima neste 2014|
|Sun Dec 21 19:17:26 +0000 2014|;|0|;|o estádio mané garrincha não estádio de copa do mundo chove 5 minuto e a bola já anda colando no gramado encharcado|
|Sun Dec 21 19:12:21 +0000 2014|;|2|;|rt AT_USER fifa confirma datas da copa do mundo da rússia URL|
|Sun Dec 21 19:12:17 +0000 2014|;|0|;|que vergonha em uma arena de copa do mundo o pessoal fkr preocupado com chuva copacaixa|
|Sun Dec 21 19:11:18 +0000 2014|;|0|;|homenagem do AT_USER a udo jürgens que várias vezes esteve presente no futebol alemão rip URL AT_USER|
|Sun Dec 21 19:08:37 +0000 2014|;|3|;|rt AT_USER e é hoje o grande dia da copa do mundo vamos brasil conquistar mais uma vitória rumo ao hexa brasil 1 x 0 alemanha ha…|
|Sun Dec 21 19:05:53 +0000 2014|;|1|;|rt AT_USER e aqle dia memorável da copa brasil x chile todo mundo fudido da cabeça ai o thiago silva deita no meio do campo e URL|
|Sun Dec 21 19:04:13 +0000 2014|;|2|;|rt AT_USER vaimedina campeão do mundo muito melhor que final de copa do mundo|
|Sun Dec 21 19:03:17 +0000 2014|;|0|;|kaká diz que ainda busca vaga na seleção de dunga esportefutebolcopamundo URL URL|
|Sun Dec 21 19:02:31 +0000 2014|;|1|;|cara copa do mundo você foi a razão da minha felicidade máxima neste 2014|
|Sun Dec 21 18:57:40 +0000 2014|;|0|;|um dos últimos capítulos sobre os estádios da copa do mundo só no sr gool URL|
|Sun Dec 21 18:56:28 +0000 2014|;|0|;|uma homenagem do AT_USER a udo jürgens que várias vezes esteve presente no futebol alemão rip URL AT_USER|
|Sun Dec 21 18:55:40 +0000 2014|;|5|;|iker casillas tem tudo -ucl -la liga -copa do rei -supercopa da espanha -supercopa uefa -mundial de clubes -eurocopa -copa do mundo|
|Sun Dec 21 18:54:03 +0000 2014|;|1|;|rt AT_USER copa do mundo sua filha da puta venha logo|
|Sun Dec 21 18:53:04 +0000 2014|;|6|;|rt AT_USER maresias vive clima de copa do mundo após título mundial de medina g1 URL|
|Sun Dec 21 18:52:56 +0000 2014|;|0|;|uma homenagem do AT_USER a udo jürgens que várias vezes esteve presente no futebol alemão rip URL|
|Sun Dec 21 18:52:40 +0000 2014|;|0|;|copa do mundo e uma mina pra curtibons tempos|
|Sun Dec 21 18:52:02 +0000 2014|;|0|;|so de pensar na copa do mundo bate aquela bad|
|Sun Dec 21 18:47:01 +0000 2014|;|0|;|todo feliz como um gol numa copa do mundo no fim do segundo tempo na prorrogação|
|Sun Dec 21 18:44:12 +0000 2014|;|5|;|rt AT_USER uma das grandes conquistas deste ano de 2014 para a bahia foi ter sediado a copa do mundo a copa das copas URL|
|Sun Dec 21 18:43:10 +0000 2014|;|4|;|rt AT_USER AT_USER AT_USER negueba vai se eleito melhor do mundo na copa aqui no brasilpodem favoritaruma cartomante …|
|Sun Dec 21 18:38:25 +0000 2014|;|8|;|rt AT_USER copa do mundo eu vou pedir pra vc vpltar pq eu te amo eu te adoro|
|Sun Dec 21 18:36:50 +0000 2014|;|0|;|sdds da copa do mundo melhores tags 😪|
|Sun Dec 21 18:31:40 +0000 2014|;|1|;|rt AT_USER deixei de acreditar em deus no dia em que vi o brasil perder a copa do mundo no maracanã|
|Sun Dec 21 18:25:43 +0000 2014|;|1|;|deixei de acreditar em deus no dia em que vi o brasil perder a copa do mundo no maracanã|
|Sun Dec 21 18:24:05 +0000 2014|;|0|;|AT_USER tu n sabe o q é copa meu deus é a melhor coisa do mundoé tipo um salamemas diferente|
|Sun Dec 21 18:22:25 +0000 2014|;|0|;|AT_USER spotify não faz copa do mundo xd|
|Sun Dec 21 18:20:40 +0000 2014|;|0|;|- e os acertos operação lava jato novo cpc copa do mundo o pulso firme de joaquim barbosa|
|Sun Dec 21 18:12:36 +0000 2014|;|0|;|o primeiro gol a estreia numa copa do mundo a emoção de saber q eu posso falar pros meus filhos eu vi meu ídolo jogando em casa é louco|
|Sun Dec 21 18:08:48 +0000 2014|;|0|;|eu não gosto de lembrar muito porque foi praticamente uma pancada que tirou o meu sonho de terminar uma copa do mundo ta doendo ta|
|Sun Dec 21 18:08:24 +0000 2014|;|6|;|sdd copa do mundo menos o 7x1|
|Sun Dec 21 18:07:24 +0000 2014|;|0|;|a grande lição da copa - a olimpíada de 2016 a exemplo do que aconteceu com a copa do mundo deste ano vai col URL|
|Sun Dec 21 18:01:53 +0000 2014|;|0|;|os primeiros 45 desse livpool vs arsenal foram padrão campeonato amazonense e os 45 finais foram padrão copa do mundo|
|Sun Dec 21 18:01:07 +0000 2014|;|0|;|futebol feminino quando é semifinafinal de copa do mundo ou olimpiadas até q dá pra assistir de resto é horroroso|
|Sun Dec 21 17:58:57 +0000 2014|;|1|;|rt AT_USER neymar abre casa revela mudança alimentar e lamenta lesão poderia ter feito história URL|
|Sun Dec 21 17:54:13 +0000 2014|;|0|;|neymar abre casa revela mudança alimentar e lamenta lesão poderia ter feito história URL|
|Sun Dec 21 17:52:00 +0000 2014|;|0|;|2014 - lembrança da copa do mundo URL|
|Sun Dec 21 17:49:40 +0000 2014|;|0|;|gostei de um vídeo AT_USER URL 2015 - final copa do mundo 2018 - brasil vs alemanha - master league -|
|Sun Dec 21 17:49:02 +0000 2014|;|0|;|100 coisas incr&ampiacuteveis que aconteceram no brasil durante a copa do mundo 2014 URL|
|Sun Dec 21 17:45:44 +0000 2014|;|0|;|aqui tá o vídeo onde aparece q niall deu um vilão autografado pro neymar aparece lá no final URL weareallzayn|
|Sun Dec 21 17:45:10 +0000 2014|;|0|;|AT_USER e apenas uma copa do mundo para os espanhóis|
|Sun Dec 21 17:45:09 +0000 2014|;|2|;|rt AT_USER bases comunitárias emancipação dos bombeiros e copa do mundo são destaques em 2014 URL URL|
|Sun Dec 21 17:40:27 +0000 2014|;|6|;|rt AT_USER o real madrid derrota o san lorenzo e se sagra campeão da copa do mundo de clubes da fifa de 2014 URL|
|Sun Dec 21 17:36:50 +0000 2014|;|0|;|deus sabe o que faz eu não gosto de rever muito por que foi uma pancada que tirou praticamente o meu sonho de terminar uma copa do mundo|
|Sun Dec 21 17:35:10 +0000 2014|;|1|;|retrôgaby2014 em 2014 tive o prazer de fazer um trabalho phoda com o monoblocohino oficial da copa do mundo URL|
|Sun Dec 21 17:30:24 +0000 2014|;|4|;|khedira fez neste ano o que roberto carlos havia feito em 2002 ganhou a champions league e a copa do mundo URL|
|Sun Dec 21 17:29:49 +0000 2014|;|17|;|rt AT_USER a pancada que tirou meu sonho de terminar uma copa do mundo como dói ouvir e lembrar disso|
|Sun Dec 21 17:28:41 +0000 2014|;|0|;|jogo é o último da equipe em alto nível antes das importantes competições do ano que vem copa do mundo e jogos pan-americanos|
|Sun Dec 21 17:26:17 +0000 2014|;|0|;|messi é o melhor do mundo em 2014 só por causa da copa a copa do mundo durou 1 mês 2014 durou 12 meses URL|
|Sun Dec 21 17:21:53 +0000 2014|;|9|;|rt AT_USER neymar no globo esporte votei no mascherano em terceiro pro ballon dor principalmente por sua copa do mundo ele f…|
|Sun Dec 21 17:20:28 +0000 2014|;|0|;|copa do mundo feels|
|Sun Dec 21 17:17:09 +0000 2014|;|0|;|21121979 morre aos 39 anos de acidente de carro ermindo onega meia da argentina na copa do mundo de 1966 URL|
|Sun Dec 21 17:14:50 +0000 2014|;|10|;|rt AT_USER o ano ruim do messi é terminar com 58 gols maior artilheiro da liga da champions e finalista da copa do mundo tá bom …|
|Sun Dec 21 17:05:54 +0000 2014|;|12|;|rt AT_USER uma pancada q terminou de tirar o meu sonho de conquistar uma copa do mundo doeu  claro q doeu 😭😭|
|Sun Dec 21 17:05:07 +0000 2014|;|0|;|esse ano o real madrid só num ganhou a copa do mundo porque num jogou|
|Sun Dec 21 17:00:57 +0000 2014|;|0|;|kit de atualização eua 72 figurinhas copa do mundo 2014 brasil panini world cup futebol URL|
|Sun Dec 21 16:59:34 +0000 2014|;|0|;|gostei de um vídeo AT_USER de AT_USER URL como destruir a copa do mundo - trollface quest 5|
|Sun Dec 21 16:58:53 +0000 2014|;|2|;|rt AT_USER podia ter copa do mundo todo ano era churras todo final de semana|
|Sun Dec 21 16:58:36 +0000 2014|;|1|;|rt AT_USER saudades anna thay e vic saudades copa do mundo neymar david luiz|
|Sun Dec 21 16:58:15 +0000 2014|;|0|;|i added a video to a AT_USER playlist URL kit de atualização eua 72 figurinhas copa do mundo 2014 brasil panini|
|Sun Dec 21 16:57:44 +0000 2014|;|0|;|gostei de um vídeo AT_USER URL de portugal na copa do mundo 2010|
|Sun Dec 21 16:53:20 +0000 2014|;|0|;|está no ar o sala de imprensa especial falando sobre o legado da copa do mundo de 2014 no brasil ao vivo conosco o ceo do col ricardo trade|
|Sun Dec 21 16:53:01 +0000 2014|;|0|;|após copa do mundo neymar afirma ter amadurecido em 2014 URL AT_USER|
|Sun Dec 21 16:49:25 +0000 2014|;|5|;|rt AT_USER revendo os jogos da copa do brasil só tenho uma coisa a dizer e com toda certeza do mundo os jogos da final foram mais…|
|Sun Dec 21 16:47:23 +0000 2014|;|2|;|rt AT_USER quis o destino queno país do futebolnuma copa do mundo no brasilo brasil fosse pela 1a vezcampeã mundial de surfe …|
|Sun Dec 21 16:46:28 +0000 2014|;|2|;|podia ter copa do mundo todo ano era churras todo final de semana|
|Sun Dec 21 16:45:55 +0000 2014|;|0|;|nem parece que a copa do mundo foi esse ano|
|Sun Dec 21 16:45:18 +0000 2014|;|3|;|rt AT_USER oq vc lembra da copa do mundo 7x1|
|Sun Dec 21 16:45:05 +0000 2014|;|0|;|AT_USER eu ja fiz isso e é um efeito de outro mundo toni kroos jogador do real madrid idolo no futebol kk acabou com o brasil na copa|
|Sun Dec 21 16:44:21 +0000 2014|;|3|;|oq vc lembra da copa do mundo 7x1|
|Sun Dec 21 16:44:19 +0000 2014|;|0|;|na áfrica do sul leopardo e cachorro são amigos - a copa do mundo ainda não começou mas a confraternização de URL|
|Sun Dec 21 16:43:58 +0000 2014|;|0|;|só ganhou uma copa do mundo e ainda passando a mão nos alemães|
|Sun Dec 21 16:43:57 +0000 2014|;|1|;|saudades anna thay e vic saudades copa do mundo neymar david luiz|
|Sun Dec 21 16:41:35 +0000 2014|;|0|;|gostei de um vídeo AT_USER de AT_USER URL e se o brasil perder a copa do mundo|
|Sun Dec 21 16:39:24 +0000 2014|;|0|;|maresias (sp) vive clima de copa do mundo após AT_USER vencer o mundial de surfe URL URL|
|Sun Dec 21 16:36:59 +0000 2014|;|0|;|no portal lrni copa fifa afirma que cumpriu meta de compensar emissão de carbono - URL|
|Sun Dec 21 16:36:56 +0000 2014|;|0|;|no portal lrni condutor de inquérito sobre copas de rússia e catar renuncia ao cargo - URL|
|Sun Dec 21 16:36:53 +0000 2014|;|0|;|no portal lrni qual o melhor am cinco narrações que marcaram a copa do mundo - URL|
|Sun Dec 21 16:36:50 +0000 2014|;|0|;|no portal lrni fifa confirma datas da copa do mundo da rússia decisão será em 15 de j URL|
|Sun Dec 21 16:35:49 +0000 2014|;|0|;|o brasil que entrou pelo cano na copa do mundo saiu pelo tubo do AT_USER  parabéns medina merecido|
|Sun Dec 21 16:35:22 +0000 2014|;|10|;|rt AT_USER namore alguém que te admire da mesma forma como o hummels admira o troféu da copa do mundo URL|
|Sun Dec 21 16:35:05 +0000 2014|;|2|;|rt AT_USER operacaobetalab após copa do mundo neymar afirma ter amadurecido em 2014 o jogador neymar fez um balanç URL|
|Sun Dec 21 16:34:32 +0000 2014|;|0|;|rt deigmar após copa do mundo neymar afirma ter amadurecido em 2014 URL|
|Sun Dec 21 16:34:27 +0000 2014|;|2|;|operacaobetalab após copa do mundo neymar afirma ter amadurecido em 2014 o jogador neymar fez um balanç URL rt|
|Sun Dec 21 16:34:20 +0000 2014|;|0|;|após copa do mundo neymar afirma ter amadurecido em 2014 o jogador neymar fez um balanço sobre as atuações p URL|
|Sun Dec 21 16:33:41 +0000 2014|;|0|;|AT_USER após copa do mundo neymar afirma ter amadurecido em 2014 o jogador neymar fez um balanço sobre URL p76|
|Sun Dec 21 16:33:39 +0000 2014|;|0|;|AT_USER após copa do mundo neymar afirma ter amadurecido em 2014 URL p73|
|Sun Dec 21 16:33:35 +0000 2014|;|0|;|após copa do mundo neymar afirma ter amadurecido em 2014 o jogador neymar fez um balanço so URL via AT_USER|
|Sun Dec 21 16:32:37 +0000 2014|;|0|;|crl deu uma sdd da copa do mundo agora|
|Sun Dec 21 16:30:46 +0000 2014|;|8|;|rt AT_USER toni kroos em 2014 ✔ bundesliga ✔ copa da alemanha ✔ copa do mundo ✔ supercopa da europa ✔ mundial de… URL|
|Sun Dec 21 16:28:19 +0000 2014|;|0|;|pode me entregar o troféu da copa do mundo foi muito clássico|
|Sun Dec 21 16:25:37 +0000 2014|;|1|;|rt AT_USER tuvalu vence o vietnã e leva o título da 52ª copa do mundo marcílio dias URL|
|Sun Dec 21 16:23:22 +0000 2014|;|1|;|rt AT_USER lindsey vonn recebe bezerro como prêmio em vitória na copa do mundo URL|
|Sun Dec 21 16:20:04 +0000 2014|;|2|;|rt AT_USER seguesigodevolta após copa do mundo neymar afirma ter amadurecido em 2014 URL|
|Sun Dec 21 16:20:01 +0000 2014|;|7|;|rt AT_USER vendo a matéria do jornal nacional com o fred e puta que pariu um cara do meu time vai ser artilheiro de uma copa do mundo…|
|Sun Dec 21 16:19:43 +0000 2014|;|1|;|rt AT_USER após copa do mundo neymar afirma ter amadurecido em 2014 o jogador neymar fez um balanço sobre as a URL|
|Sun Dec 21 16:18:55 +0000 2014|;|8|;|toni kroos em 2014 ✔ bundesliga ✔ copa da alemanha ✔ copa do mundo ✔ supercopa da europa ✔ mundial de… URL|
|Sun Dec 21 16:18:53 +0000 2014|;|2|;|domingo em casa com o filhão vendo o jogo do liverpool com a narração do amigo AT_USER companheiro de copa do mundo de futsal|
|Sun Dec 21 16:15:25 +0000 2014|;|0|;|um novo ano está quase chegando e isso significa que é hora de ver o que foi popular nas buscas do google em 2014 URL|
|Sun Dec 21 16:13:40 +0000 2014|;|0|;|mé que um pais que sediou a copa do mundo entra em crise no mesmo ano|
|Sun Dec 21 16:13:12 +0000 2014|;|11|;|rt AT_USER iker casillas é o pior goleiro do mundo deu vexame na copa não vai ganhar nada frangueiro lixo URL|
|Sun Dec 21 16:10:48 +0000 2014|;|0|;|[folha spaulo bra] após copa do mundo neymar afirma ter amadurecido em 2014 o jogador neymar  URL vía jamv|
|Sun Dec 21 16:08:10 +0000 2014|;|0|;|the best of 2014 copa do mundo eleições gone girl skol beats|
|Sun Dec 21 16:06:12 +0000 2014|;|0|;|AT_USER só falta uma copa do mundo|
|Sun Dec 21 16:03:42 +0000 2014|;|4|;|rt AT_USER del filho é executivo e foi coordenador da fifa na copa das confederações e na copa do mundo no brasil novidades não p…|
|Sun Dec 21 16:03:42 +0000 2014|;|0|;|neymar não entendeu que fizeram historia sim 7x1 numa semi final de copa do mundo nao é pra qualquer um|
|Sun Dec 21 16:03:25 +0000 2014|;|3|;|operacaobetalab após copa do mundo neymar afirma ter amadurecido em 2014 URL rt sdv|
|Sun Dec 21 16:03:16 +0000 2014|;|0|;|novo artigo - acesse após copa do mundo neymar afirma ter amadurecido em 2014 URL URL|
|Sun Dec 21 16:03:05 +0000 2014|;|0|;|não sinvolva com o campeão da copa do mundo per é mais q vc coutinho|
|Sun Dec 21 16:01:33 +0000 2014|;|0|;|AT_USER sem copa do mundo n rola|
|Sun Dec 21 16:00:29 +0000 2014|;|0|;|saudades da época em que o harry tava gordo ele tava parecendo a bola de futebol da copa do mundo o liam ta até agora😙😙|
|Sun Dec 21 15:59:58 +0000 2014|;|0|;|2112 fim do mundo mais atrasado que as obras da copa|
|Sun Dec 21 15:59:19 +0000 2014|;|0|;|vídeos da princesas da disney bonecas - miss mundo copa do mundo aniversário de elsa - em inglêsghh URL|
|Sun Dec 21 15:57:25 +0000 2014|;|0|;|betacaralhudosan após copa do mundo neymar afirma ter amadurecido em 2014 o jogador neyma URL betacaralhudosan|
|Sun Dec 21 15:56:51 +0000 2014|;|2|;|após copa do mundo neymar afirma ter amadurecido em 2014 o jogador neymar fez um balanço sobre as a URL timbeta|
|Sun Dec 21 15:56:49 +0000 2014|;|0|;|(folha) após copa do mundo neymar afirma ter amadurecido em 2014 o jogador neymar fez um balanço sobre as at URL|
|Sun Dec 21 15:56:16 +0000 2014|;|0|;|AT_USER após copa do mundo neymar afirma ter amadurecido em 2014 o jogador neymar fez um balanço sobre as at URL|
|Sun Dec 21 15:54:46 +0000 2014|;|1|;|rt AT_USER betalab após copa do mundo neymar afirma ter amadurecido em 2014 URL|
|Sun Dec 21 15:46:11 +0000 2014|;|1|;|após copa do mundo neymar afirma ter amadurecido em 2014 URL via uol notícias|
|Sun Dec 21 15:46:03 +0000 2014|;|1|;|seguesigodevolta após copa do mundo neymar afirma ter amadurecido em 2014 URL|
|Sun Dec 21 15:46:01 +0000 2014|;|0|;|edw após copa do mundo neymar afirma ter amadurecido em 2014 URL|
|Sun Dec 21 15:45:44 +0000 2014|;|0|;|as fotos do sbornia vão sair na próxima copa do mundo|
|Sun Dec 21 15:45:39 +0000 2014|;|0|;|copa 2018 -fifa confirma datas da copa do mundo de 2018 - URL|
|Sun Dec 21 15:45:20 +0000 2014|;|0|;|AT_USER AT_USER se for assim o corinthians foi vice campeão mundial em 1952 (copa rio) e campeão da mini copa do mundo em 1953|
|Sun Dec 21 15:44:38 +0000 2014|;|1|;|betalab após copa do mundo neymar afirma ter amadurecido em 2014 URL|
|Sun Dec 21 15:44:33 +0000 2014|;|0|;|após copa do mundo neymar afirma ter amadurecido em 2014 URL folheando a AT_USER|
|Sun Dec 21 15:44:29 +0000 2014|;|0|;|operacaobetalab após copa do mundo neymar afirma ter amadurecido em 2014 URL sdv rt|
|Sun Dec 21 15:44:16 +0000 2014|;|0|;|rt1 após copa do mundo neymar afirma ter amadurecido em 2014 URL|
|Sun Dec 21 15:44:12 +0000 2014|;|0|;|sigodevolta após copa do mundo neymar afirma ter amadurecido em 2014 URL|
|Sun Dec 21 15:44:06 +0000 2014|;|0|;|uol após copa do mundo neymar afirma ter amadurecido em 2014 URL|
|Sun Dec 21 15:44:03 +0000 2014|;|2|;|rt AT_USER escutar oea bate aquela vontade de viver tudo que vivi nesse ano volta copa do mundo|
|Sun Dec 21 15:42:46 +0000 2014|;|0|;|agora ele pode dizer que caiu de maduro rt AT_USER após copa do mundo neymar afirma ter amadurecido em 2014 URL|
|Sun Dec 21 15:42:36 +0000 2014|;|0|;|AT_USER o mundial da fifa é campeonato a copa do mundo é campeonato a copa libertadores é campeonato|
