|Fri Dec 12 12:20:10 +0000 2014|;|0|;|AT_USER vai chega uns disc e nike shox em fi|
|Fri Dec 12 12:20:06 +0000 2014|;|0|;|acabei de correr 404 km com o nike+ URL nikeplus|
|Fri Dec 12 12:18:43 +0000 2014|;|0|;|acabei de correr 800 km com um ritmo de 557 com o nike+ URL nikeplus|
|Fri Dec 12 12:18:30 +0000 2014|;|0|;|hora do jantar de despedida de seoul 🇰🇷 bfpelomundo atitudeboaforma nike nikemulheres nikewomen… URL|
|Fri Dec 12 12:15:08 +0000 2014|;|0|;|acabei de correr 690 km com o nike+ URL nikeplus|
|Fri Dec 12 12:14:48 +0000 2014|;|0|;|nike paul rodriguez sz 40-44 idr 175 52b6e15f  081310679347 URL|
|Fri Dec 12 12:13:59 +0000 2014|;|0|;|nike domina com folga a artilharia de chuteiras na liga dos campeões - guia do boleiro URL|
|Fri Dec 12 12:12:48 +0000 2014|;|0|;|acabei de correr 233 km com o nike+ URL nikeplus|
|Fri Dec 12 12:12:41 +0000 2014|;|0|;|AT_USER larga de ser bixa e põe o nike na liberdade|
|Fri Dec 12 12:09:37 +0000 2014|;|0|;|acabei com uma corrida de 91 km a com um ritmo de 58 com nike+ sportwatch gps nikeplus makeitcount URL|
|Fri Dec 12 12:09:30 +0000 2014|;|0|;|gamei em um tênis da nike 😍 só que a belezinha custa 500 reais e mamãe não quer me dar 😒|
|Fri Dec 12 12:08:27 +0000 2014|;|0|;|at URL -- ok foco 🏃calentando motores hmnyc 21kny2015 nike nikeplus corre voypor URL|
|Fri Dec 12 12:08:18 +0000 2014|;|0|;|é que as menina é o terror é que as menina é tenebrosa invés de usar tamanquinho elas usa nike de mola|
|Fri Dec 12 12:07:55 +0000 2014|;|0|;|gostei de um vídeo AT_USER URL commercials - nike - soccer vs ninjas|
|Fri Dec 12 12:07:39 +0000 2014|;|1|;|rt AT_USER AT_USER AT_USER nike no pé shortinho e top verde limão e o lacinho no cabelo da época 2008|
|Fri Dec 12 12:07:21 +0000 2014|;|1|;|AT_USER AT_USER nike no pé shortinho e top verde limão e o lacinho no cabelo da época 2008|
|Fri Dec 12 12:06:55 +0000 2014|;|0|;|aí vc vê um ser com a mochila da nike e o preço grandão pendurado pra tras pqp coisasdometrô URL|
|Fri Dec 12 12:03:01 +0000 2014|;|0|;|acabei de correr uma corrida de 307 km com o nike+ URL nikeplus|
|Fri Dec 12 12:01:36 +0000 2014|;|0|;|primeiro tênis de skate com nike free pela primeira vez a liberdade e flexibilidade da… URL|
|Fri Dec 12 12:01:34 +0000 2014|;|0|;|triplex pra coroa é o que malandro quer não só desfilar de nike no pé|
|Fri Dec 12 11:58:09 +0000 2014|;|2399|;|rt AT_USER thbarbosa thiagolaa recebi seu presente da AT_USER aqui rapais obrigado viu vc é feraa URL|
|Fri Dec 12 11:57:32 +0000 2014|;|0|;|acabei de correr 102 km com um ritmo de 623km com o nike+ URL nikeplus|
|Fri Dec 12 11:57:21 +0000 2014|;|0|;|AT_USER AT_USER queria fazer um nike no meu kk mentira|
|Fri Dec 12 11:56:27 +0000 2014|;|0|;|AT_USER hahaha inventa outra  só pego homem amor mtvstars beyonce|
|Fri Dec 12 11:54:39 +0000 2014|;|0|;|photo nike c URL|
|Fri Dec 12 11:54:14 +0000 2014|;|0|;|breve mas válido acabei de correr 194 km com um ritmo de 833km com o nike+ URL nikeplus URL|
|Fri Dec 12 11:52:24 +0000 2014|;|0|;|ela hoje nem foi com o patrocínio da nike né amiga karlahrznunes  lindas ) @ pro sport academia -… URL|
|Fri Dec 12 11:48:11 +0000 2014|;|0|;|treinando em manaus circuito peitoombrobícepstiros+ 2k p fechar acabei de correr 200 km com o nike+ URL nikeplus|
|Fri Dec 12 11:47:22 +0000 2014|;|0|;|AT_USER acorda querida eu vi voce com sandrao sapatao mtvstars beyonce|
|Fri Dec 12 11:46:01 +0000 2014|;|0|;|AT_USER nao eu nao sou gay|
|Fri Dec 12 11:44:47 +0000 2014|;|0|;|acabei de correr 737 km com o nike+ URL nikeplus|
|Fri Dec 12 11:43:12 +0000 2014|;|0|;|e uma polo show da nike|
|Fri Dec 12 11:43:05 +0000 2014|;|1|;|rt AT_USER AT_USER  dá ré no kibe né viado mtvstars beyonce|
|Fri Dec 12 11:42:41 +0000 2014|;|1|;|AT_USER  dá ré no kibe né viado mtvstars beyonce|
|Fri Dec 12 11:40:59 +0000 2014|;|0|;|AT_USER sim eu adoro uma pomba|
|Fri Dec 12 11:39:09 +0000 2014|;|0|;|AT_USER não porque  você é gay  mtvstars beyonce|
|Fri Dec 12 11:38:10 +0000 2014|;|0|;|porque comemorar também é bom timtim cheers bfpelomundo atitudeboaforma nike nikemulheres… URL|
|Fri Dec 12 11:32:14 +0000 2014|;|0|;|AT_USER que cachorrinho mais simpatico tudo bem nike|
|Fri Dec 12 11:31:38 +0000 2014|;|0|;|[video]cr7 em fora deste mundo simplesmente espetacular nike comercial promovendo as botas novas que cristiano URL|
|Fri Dec 12 11:31:14 +0000 2014|;|0|;|AT_USER guto8080 meu nike|
|Fri Dec 12 11:30:18 +0000 2014|;|0|;|acabei de correr 101 km com um ritmo de 756km com o nike+ URL nikeplus|
|Fri Dec 12 11:28:03 +0000 2014|;|0|;|2014 chegou ao final férias merecidas URL|
|Fri Dec 12 11:26:55 +0000 2014|;|0|;|acabei de correr 765 km com um ritmo de 834km com o nike+ nikeplus|
|Fri Dec 12 11:26:39 +0000 2014|;|0|;|acabei de correr 265 km com um ritmo de 542km com o nike+ URL nikeplus|
|Fri Dec 12 11:26:03 +0000 2014|;|9|;|rt AT_USER fui comprar um nike e só tinha esses modelos verde fluorescente com laranja radioativo|
|Fri Dec 12 11:23:58 +0000 2014|;|0|;|fotos do passeio ciclístico resende nike night realizado na quarta 10122014 mt bom URL|
|Fri Dec 12 11:21:57 +0000 2014|;|0|;|depois que enfiei um nike air jordan no p no deu mais|
|Fri Dec 12 11:20:47 +0000 2014|;|0|;|franelas para damas roxy  nike aeropostale franelas para damas roxy  nike aeropostale 100% al ··-▶ URL ropa|
|Fri Dec 12 11:16:32 +0000 2014|;|0|;|acabei de correr 505 km com o nike+ URL nikeplus|
|Fri Dec 12 11:16:22 +0000 2014|;|0|;|5119 min - 480 cal acabei de correr 634 km com o nike+ URL nikeplus URL|
|Fri Dec 12 11:15:40 +0000 2014|;|0|;|ontem fui td de adidas hoje todo de nike|
|Fri Dec 12 11:14:15 +0000 2014|;|0|;|acabei de correr 488 km com o nike+ URL nikeplus|
|Fri Dec 12 11:12:35 +0000 2014|;|0|;|mãe lavo meu nike ainda bem😂👌|
|Fri Dec 12 11:12:29 +0000 2014|;|0|;|o joel comprou umas luvas voadoras e da nike pahahah 😂😂|
|Fri Dec 12 11:11:49 +0000 2014|;|0|;|nike como forma de vidaa😜😜 URL|
|Fri Dec 12 11:10:49 +0000 2014|;|0|;|a thaís vai dar um nike de 700 reias pro namorado dela pra ele dar um cel de 2 mil pra ela|
|Fri Dec 12 11:08:48 +0000 2014|;|1|;|rt AT_USER fechando o primeiro ano de corridas acabei de correr 100 km com o nike+ URL nikeplus URL|
|Fri Dec 12 11:07:12 +0000 2014|;|0|;|no amigo x ganhei uma camisa da nike e o primeiro livro da série game of trohnes|
|Fri Dec 12 11:06:15 +0000 2014|;|0|;|acabei de correr 497 km com um ritmo de 802 com o nike+ URL nikeplus|
|Fri Dec 12 11:05:34 +0000 2014|;|0|;|nike quer r$ 25 milhões de funcionários que foram para adidas URL|
|Fri Dec 12 11:04:32 +0000 2014|;|0|;|quero duas coisas  o desbloquei-o do iphone e as nike air force|
|Fri Dec 12 11:03:42 +0000 2014|;|0|;|acabei com uma corrida de 50 km a com um ritmo de 70 com nike+ sportwatch gps nikeplus makeitcount URL|
|Fri Dec 12 11:01:48 +0000 2014|;|0|;|gosto nike air max em AT_USER 😪 lindas URL URL|
|Fri Dec 12 10:59:10 +0000 2014|;|0|;|🌞🌴🌴🏃🏃praia#ferias#running acabei de correr 508 km com o nike+ URL nikeplus|
|Fri Dec 12 10:58:22 +0000 2014|;|0|;|acabei de correr 370 km com um ritmo de 931km com o nike+ URL nikeplus|
|Fri Dec 12 10:57:27 +0000 2014|;|0|;|encontrei umas nike air max por 50€ perfeitas  quero-as tanto|
|Fri Dec 12 10:56:14 +0000 2014|;|0|;|s h o e s  mens ladys newbalance nike moutonboots nobrand URL|
|Fri Dec 12 10:55:28 +0000 2014|;|0|;|acabei de correr 829 km com o nike+ URL nikeplus|
|Fri Dec 12 10:55:19 +0000 2014|;|0|;|AT_USER oi amizade ele cheirou meu celular acho que ele quis dizer que o nome dele é nike|
|Fri Dec 12 10:53:17 +0000 2014|;|1|;|rt AT_USER AT_USER um nike air force mid pesquisa ai|
|Fri Dec 12 10:52:57 +0000 2014|;|1|;|AT_USER um nike air force mid pesquisa ai|
|Fri Dec 12 10:50:43 +0000 2014|;|0|;|acabei de correr 502 km com o nike+ URL nikeplus|
|Fri Dec 12 10:49:46 +0000 2014|;|0|;|disciplinatrasprazer daprafazermais acabei de correr 481 km com o nike+ URL nikeplus|
|Fri Dec 12 10:47:28 +0000 2014|;|0|;|elas não usa tamanquinho elas usa nike de mola 🎶 AT_USER|
|Fri Dec 12 10:47:08 +0000 2014|;|0|;|acabei de correr 1322 km com um ritmo de 644 com o nike+ URL nikeplus|
|Fri Dec 12 10:47:00 +0000 2014|;|0|;|nada mal acabei de correr 1322 km com um ritmo de 644 com o nike+ URL nikeplus|
|Fri Dec 12 10:46:28 +0000 2014|;|0|;|acabei de correr 505 km com um ritmo de 729km com o nike+ URL nikeplus|
|Fri Dec 12 10:44:59 +0000 2014|;|0|;|aques nike baixin de boy 😎😹|
