|Thu Nov 27 12:58:54 +0000 2014|;|0|;|capa case galaxys5 spigenultrafit produto novo original na caixa **oferta 799** URL|
|Thu Nov 27 11:29:04 +0000 2014|;|0|;|novidade novo samsung galaxy pocket 2 na compra deste smartphone têm oferta de 600mb válidos durante 3 meses URL|
|Thu Nov 27 10:32:57 +0000 2014|;|0|;|a AT_USER se juntou com AT_USER loja brava store e blog turbilhão de sentimentos para me presentear URL|
|Thu Nov 27 07:00:07 +0000 2014|;|0|;|há um novo comentário sobre samsung galaxy s5 duos g900md branco 4g - desbloqueado URL via AT_USER URL|
|Thu Nov 27 06:00:17 +0000 2014|;|0|;|há um novo comentário sobre samsung galaxy s5 g900m azul 4g - desbloqueado - agra URL via AT_USER URL|
|Thu Nov 27 05:36:00 +0000 2014|;|0|;|conheça o smartphone galaxy alpha o mais novo lançamento da samsung URL|
|Thu Nov 27 03:30:51 +0000 2014|;|0|;|AT_USER é q eu preciso de um cel novo e tal mas nenhum me agrada skjdd só esse o meu é um galaxy sii|
|Thu Nov 27 02:10:05 +0000 2014|;|0|;|vontade de assistir guardians of the galaxy de novo|
|Thu Nov 27 02:00:05 +0000 2014|;|0|;|os grandes na mesa testamos o novo galaxy note 4 e logo logo tem vídeo novo no canal acessem URL|
|Thu Nov 27 01:17:35 +0000 2014|;|0|;|de celular novo amém galaxy s5 o número continua o mesmo (claro) õ|
|Thu Nov 27 01:08:53 +0000 2014|;|0|;|AT_USER AT_USER nexusg2galaxy e pesquisarei sobre esse zenfone e o lumia novo falaram bastante dele e ainda tem moto x|
|Wed Nov 26 23:12:06 +0000 2014|;|0|;|meu brinquedo novo to adorando tablet samsung galaxy com chip tem gps e faz ligação nunca mais vou me perde da URL|
|Wed Nov 26 23:08:59 +0000 2014|;|0|;|celular novo e posso afirmar que é muito melhor que o galaxy s4 é um sony xperia z3|
|Wed Nov 26 20:14:24 +0000 2014|;|17|;|rt AT_USER o novo galaxy s5 será a prova dágua agora eu posso usar como prancha de surf quando tiver enchente|
|Wed Nov 26 19:56:21 +0000 2014|;|0|;|tô vendendo um galaxy s4 branco completo semi-novo sem arranhões nem nada|
|Wed Nov 26 19:43:01 +0000 2014|;|0|;|AT_USER sdv fc novo atrêluanetes|
|Wed Nov 26 18:53:15 +0000 2014|;|0|;|novo post no grupo bitcoin vendo galaxy k zoom hexacore 207mpx zoom ótico 10x capa e cartão de 16gb valor 2 bitcoins by via bitcoi|
|Wed Nov 26 18:47:06 +0000 2014|;|0|;|estou com meu celular novo mas é um galaxy quero meu iphone devolta 😞😞😢|
|Wed Nov 26 18:36:34 +0000 2014|;|0|;|tomara que eu ganhe meu cel novo no natal namoral não aguento mais esse galaxy|
|Wed Nov 26 17:22:31 +0000 2014|;|0|;|AT_USER AT_USER sei que talvez vc não me tire do tédio mas eu comprei um celular novo samsung galaxy s4 mini ♥kk|
|Wed Nov 26 17:10:34 +0000 2014|;|0|;|s 6 - novo veja as especificações do galaxy s6 isso mesmo a samsung mal lançou o galaxy s5 e o note 4 e como URL|
|Wed Nov 26 17:06:24 +0000 2014|;|0|;|meu primeiro celular novo q não foi repassado de parente ganhei ano passado eu comprei com meu dinheiro trabalhando era um galaxy y|
|Wed Nov 26 16:41:33 +0000 2014|;|0|;|novo tópico [tor][brrip] guardiões da galáxia  guardians of the galaxy (2014) URL|
|Wed Nov 26 16:41:32 +0000 2014|;|0|;|novo tópico [tor][brrip][720p] guardiões da galáxia  guardians of the galaxy (2014) URL|
|Wed Nov 26 16:09:57 +0000 2014|;|0|;|post novo &lt3 ootd fresquinho direto da galeria AT_USER na oscar freire URL URL|
|Wed Nov 26 15:39:18 +0000 2014|;|0|;|eu e a minha mania de galaxy no novo moto g kk|
|Wed Nov 26 15:03:11 +0000 2014|;|0|;|vendo samsung galaxy ace - gt-s5830b semi novo - conectividade total com facebook whatsapp viber etc câmera URL|
|Wed Nov 26 13:33:28 +0000 2014|;|0|;|quero só ver quem vai me dar um celular novo de natal só para não ficar na dúvida kro um moto g ou nokia lumia 925ou o galaxy s5|
|Wed Nov 26 13:03:43 +0000 2014|;|0|;|telefones venda 52402 iphone novo r$ 99 galaxy r$ 319 ace 3 r$ 399 pré 3423-1200|
|Wed Nov 26 13:01:56 +0000 2014|;|0|;|o meu pai tem um telemóvel novo mas não sabe mexer nele é um samsung galaxy AT_USER AT_USER AT_USER AT_USER AT_USER|
|Wed Nov 26 12:57:47 +0000 2014|;|0|;|pra quem perdeu o comparativo entre o novomotog vs galaxygranprime veja no que deu URL 👈😋 URL|
|Wed Nov 26 12:46:48 +0000 2014|;|0|;|ola pessoal estou vendendo meu celular semi novo galaxy s4 por r$ 200 com 4 meses de uso e 3 anos de URL|
|Wed Nov 26 11:09:00 +0000 2014|;|0|;|vendo galáxy win novo com carregador 8 go de memória interna contacto pra negociar ou vender 64 93312468|
|Wed Nov 26 07:00:04 +0000 2014|;|0|;|há um novo comentário sobre samsung galaxy s5 g900m dourado 4g - desbloqueado - a URL via AT_USER URL|
|Wed Nov 26 06:00:18 +0000 2014|;|0|;|há um novo comentário sobre samsung galaxy s5 duos g900md preto 4g - desbloqueado URL via AT_USER URL|
|Wed Nov 26 04:24:36 +0000 2014|;|0|;|terça que vemvou tá com meu novo galaxy|
|Wed Nov 26 04:12:48 +0000 2014|;|0|;|fazendo a cabeça de mainha pra ela comprar um celular novo pra mim porque esse galaxy y tá só a negação|
|Wed Nov 26 04:02:40 +0000 2014|;|0|;|galaxy tab pro 84 com 3 meses de uso tenho fone usb e carregador aceito trocas de moto x ou moto g2 URL|
|Wed Nov 26 03:57:48 +0000 2014|;|0|;|trocaria meu galaxy s3 facilmente pelo novo moto g porque o galaxy ta um merda|
|Wed Nov 26 02:25:15 +0000 2014|;|1|;|rt AT_USER novo post no grupo bitcoin vendo galaxy k zoom hexacore 207mpx zoom ótico 10x capa e cartão de 16gb valor 2 bitcoi…|
|Wed Nov 26 02:19:33 +0000 2014|;|1|;|URL galaxy s5 duos 4g branco novo completo nota e garantia|
|Wed Nov 26 02:13:41 +0000 2014|;|0|;|AT_USER eu to com o galaxy player de novo entõ voltarei a tirar fotos|
|Wed Nov 26 02:09:21 +0000 2014|;|0|;|AT_USER dai vai de vc so q tbm ouvi dizer que o novo galaxy s5 ta mto bom tbm|
|Wed Nov 26 00:57:51 +0000 2014|;|0|;|to na dúvida se pego outro iphone ou o novo galaxy|
|Tue Nov 25 23:23:34 +0000 2014|;|0|;|AT_USER eu ganhei um cell novo um galaxy neoum microscopio e por ultimo um tablet|
|Tue Nov 25 22:46:52 +0000 2014|;|0|;|AT_USER samsung galaxy tab pro 84 16gb novo (aceito trocas) (guarulhos) r$ 700 URL brasil|
|Tue Nov 25 22:33:32 +0000 2014|;|0|;|juro que não tenho vergonha do meu lindo e belo galaxy y mas um celular novo já tá uma necessidade mais que necessidade|
|Tue Nov 25 22:25:54 +0000 2014|;|0|;|AT_USER vc respira de novo ta 10% mano eu odeio essa bateria pq não podia ser igual a do galaxy s5 duraria sua vida e ainda a morte|
|Tue Nov 25 19:35:39 +0000 2014|;|0|;|caraalho que foda man pqp fairy tail tá me deixando feliz de novo pqp sodijodsj|
|Tue Nov 25 18:29:32 +0000 2014|;|0|;|meu pai vai me da um celular novo 😍😍 (galaxy s5) 😍😍|
|Tue Nov 25 18:22:24 +0000 2014|;|0|;|trailer novo do jurassic-qquer-coisa start wars (cenários) com resident evil (monstro genético) e guardians of the galaxy meh|
|Tue Nov 25 17:51:08 +0000 2014|;|0|;|o novo galaxy s5 será a prova dágua - agora eu posso usar como prancha de surf quando tiver enchente|
|Tue Nov 25 17:20:10 +0000 2014|;|17|;|o novo galaxy s5 será a prova dágua agora eu posso usar como prancha de surf quando tiver enchente|
|Tue Nov 25 17:17:14 +0000 2014|;|2|;|rt AT_USER novo smartphone da samsung galaxy nose papéis de parede 3d vai ficar de fora dessa URL|
|Tue Nov 25 17:05:29 +0000 2014|;|2|;|novo smartphone da samsung galaxy nose papéis de parede 3d vai ficar de fora dessa URL|
|Tue Nov 25 16:05:46 +0000 2014|;|0|;|ate minha mae ganhou celular novo tbm e eu aqui com o meu galaxy estragado tem uns 4 meses pois é|
|Tue Nov 25 15:44:25 +0000 2014|;|0|;|AT_USER dizem q o galaxy s4 é bom e tem o moto g tbm ou o mais novo moto x sei la kk to pensando se compro o iphone 5s ou moto g|
|Tue Nov 25 15:23:59 +0000 2014|;|0|;|novo preço no samsung galaxy note 101 2014 ➜ 56499€ (poupe 13%) o samsung galaxy note 101 edition 2014 é URL|
|Tue Nov 25 15:11:17 +0000 2014|;|0|;|capa case spigen ultrafit celular galaxys5 produto novo original na caixa URL AT_USER URL|
|Tue Nov 25 14:36:41 +0000 2014|;|0|;|comprei o novo galaxy gran prime ♡☆ perfeito|
|Tue Nov 25 14:28:11 +0000 2014|;|0|;|AT_USER a tela do meu galaxy s3 quebrou ao invés de arrumar queria algo novo|
|Tue Nov 25 13:01:36 +0000 2014|;|0|;|cara a mãe vai me dar um celular novo sexta-feira to muito na duvida entre um iphone 5 e um galaxy s4|
|Tue Nov 25 12:52:31 +0000 2014|;|0|;|agora na ipub tech chegou com tecnologia qualidade design seu novo smartphone o samsung galaxy gran prime URL|
|Tue Nov 25 12:52:31 +0000 2014|;|0|;|album novo do the asteroids galaxy tour ta tão maravilhoso|
|Tue Nov 25 07:26:03 +0000 2014|;|0|;|galaxy s6 site divulga supostas informações do novo smartphone  - canaltech URL|
|Tue Nov 25 07:00:03 +0000 2014|;|0|;|há um novo comentário sobre samsung galaxy s5 g900m branco 4g - desbloqueado - ag URL via AT_USER URL|
|Tue Nov 25 06:00:11 +0000 2014|;|0|;|há um novo comentário sobre samsung galaxy s5 g900m preto 4g - desbloqueado - agr URL via AT_USER URL|
|Tue Nov 25 02:45:19 +0000 2014|;|0|;|galaxy s6 site divulga supostas informações do novo smartphone da samsung - samsung URL|
|Tue Nov 25 02:24:08 +0000 2014|;|0|;|quando meu celular novo chegar vou vender o meu galaxy y por 100 pila no mercado livre|
|Tue Nov 25 01:25:16 +0000 2014|;|0|;|acho que meu novo celular será um galaxy só n sei qual|
|Tue Nov 25 00:33:44 +0000 2014|;|0|;|em janeiro vou comprar um galaxy 5 não aguento mais essa merda toda semana um carregador novo|
|Tue Nov 25 00:32:17 +0000 2014|;|0|;|galaxy s6 site divulga supostas informações do novo smartphone da samsung - samsung URL via AT_USER AT_USER|
|Tue Nov 25 00:10:59 +0000 2014|;|0|;|já tem supostas informações sobre o galaxy s6 - URL|
|Mon Nov 24 23:52:20 +0000 2014|;|0|;|vendo samsung galaxy s5 como novo com pelicula no ecra impecavel desbloqueado a funcionar sem problemas vem URL|
|Mon Nov 24 22:45:06 +0000 2014|;|0|;|ca entre nós perdendo a graca AT_USER galaxy s6 site divulga informações do novo smartphone da samsung URL|
|Mon Nov 24 22:34:46 +0000 2014|;|5|;|rt AT_USER galaxy s6 site divulga supostas informações do novo smartphone da samsung URL|
|Mon Nov 24 22:30:36 +0000 2014|;|0|;|novo status pessoas que visitaram meu perfil URL|
|Mon Nov 24 22:30:13 +0000 2014|;|0|;|destaque inforgráfico de comparativo galaxy granprime vs novo motog - quem ganha &gt&gt URL|
|Mon Nov 24 22:05:01 +0000 2014|;|5|;|galaxy s6 site divulga supostas informações do novo smartphone da samsung URL|
|Mon Nov 24 21:48:45 +0000 2014|;|0|;|galaxy s6 site divulga supostas informações do novo smartphone da samsung URL via AT_USER|
|Mon Nov 24 21:25:05 +0000 2014|;|0|;|samsung galaxy s5 vendeu menos do que o galaxy s4 - samsung lançou o seu novo smartphone galaxy s5 em abril de URL|
|Mon Nov 24 21:18:21 +0000 2014|;|1|;|rt AT_USER galaxy note 4 já estamos testando o novo phablet da samsung URL|
|Mon Nov 24 21:08:53 +0000 2014|;|0|;|AT_USER claro que não vou ficar com um galaxy provisório até meu pai criar vergonha na cara e me dar um iphone novo|
|Mon Nov 24 20:32:57 +0000 2014|;|0|;|se for assim comprarei sem ver concorrentes URL|
|Mon Nov 24 20:07:38 +0000 2014|;|0|;|galaxy s6 site divulga supostas informações do novo smartphone da samsung URL suportebigdata|
|Mon Nov 24 19:57:20 +0000 2014|;|0|;|galaxy s6 site divulga supostas informações do novo smartphone da samsung o ano não foi lá muito bom para a  URL|
|Mon Nov 24 19:56:26 +0000 2014|;|0|;|baixando o filme guardians of the galaxy *-* assistir de novo desta vez em casa|
|Mon Nov 24 19:42:42 +0000 2014|;|376|;|rt AT_USER novo galaxy s ii ou iphone qual deles é o bicho|
|Mon Nov 24 19:23:15 +0000 2014|;|1|;|começa a twitcam de novo ficou off AT_USER twitcamluansantanahoje17h|
|Mon Nov 24 18:16:53 +0000 2014|;|0|;|comprei meu cel é o novo galaxy prime hahaha|
|Mon Nov 24 17:16:43 +0000 2014|;|7|;|rt AT_USER gente idéias de video please tive um probleminha com minha câmera e não queria deixar vcs sem vídeo de novo o que gr…|
|Mon Nov 24 15:18:26 +0000 2014|;|0|;|bom dia amigos estou vendendo um galaxy s4 branco 4g semi novo na caixa com nota fiscal único donointeressados enviar dm parcelo cartão|
|Mon Nov 24 15:02:43 +0000 2014|;|0|;|novos de novo reposição do lcd completo samsung galaxy s3 e s4 peças totalmente originais… URL|
|Mon Nov 24 14:31:25 +0000 2014|;|0|;|acho que vou compra o novo sansung galaxy gran|
|Mon Nov 24 14:18:45 +0000 2014|;|0|;|capa case spigen ultrafit galaxys5 produto novo original na caixa ofrta 799 URL URL|
|Mon Nov 24 14:08:40 +0000 2014|;|0|;|galaxy note 4 já estamos testando o novo phablet da samsung URL|
|Mon Nov 24 13:15:23 +0000 2014|;|0|;|afd todo mundo de celular novo aqui em casa e eu com esse galaxy y todo fodido|
|Mon Nov 24 12:22:33 +0000 2014|;|0|;|AT_USER vc pode me ajudar rápidinho indica esse fc novo &gt AT_USER &lt|
|Mon Nov 24 12:18:12 +0000 2014|;|0|;|pessoal já já tem vídeo novo no canal análise do galaxy note 4  assistam se inscrevam e… URL|
|Mon Nov 24 11:56:24 +0000 2014|;|0|;|meu tio descobriu o android no galaxy e tá todo encantado aqui pq sente q entrou num mundo novo coitado uaheuaheauheauh|
|Mon Nov 24 07:48:33 +0000 2014|;|0|;|novo vídeo demonstra mudanças do android 50 lollipop no  - URL URL|
|Mon Nov 24 06:00:10 +0000 2014|;|0|;|há um novo comentário sobre samsung galaxy s5 duos g900md dourado 4g - desbloquead URL via AT_USER URL|
|Mon Nov 24 03:46:37 +0000 2014|;|3|;|rt AT_USER operacaobetalab novo vídeo demonstra mudanças do android 50 lollipop no samsung galaxy s5 URL rt sdv|
|Mon Nov 24 03:42:56 +0000 2014|;|2|;|rt AT_USER operacaobetalab novo vídeo demonstra mudanças do android 50 lollipop no samsung galaxy s5 URL rt …|
|Mon Nov 24 03:42:09 +0000 2014|;|0|;|AT_USER novo moto g ou galaxy gran prime|
|Mon Nov 24 03:28:13 +0000 2014|;|2|;|operacaobetalab novo vídeo demonstra mudanças do android 50 lollipop no samsung galaxy s5 URL rt sdv|
|Mon Nov 24 03:09:50 +0000 2014|;|0|;|AT_USER AT_USER o galaxy s4 ou então tem um novo q é pika esquec o nome dps te mostro|
|Mon Nov 24 01:42:45 +0000 2014|;|0|;|vendo capa flip cover s-view para celular samsung galaxy s5 com visor r$ 3990(obs produto novo comprei errado)|
|Mon Nov 24 01:20:26 +0000 2014|;|0|;|AT_USER kk é que to precisando de um novo meu pai vai me dar de natal tenho um lixo samsung galaxy young ¬¬|
|Mon Nov 24 00:56:31 +0000 2014|;|0|;|tele novohihi prendinha galaxy s|
|Mon Nov 24 00:08:43 +0000 2014|;|0|;|só quero saber quando sai guardians of the galaxy em blu-ray pra poder assistir de novo essa belezinha|
|Sun Nov 23 23:46:58 +0000 2014|;|0|;|quem liga pra iphone depois desse novo galaxy|
|Sun Nov 23 23:28:23 +0000 2014|;|1|;|rt AT_USER novo vídeo demonstra mudanças do android 50 lollipop no  - URL URL|
|Sun Nov 23 23:00:35 +0000 2014|;|0|;|AT_USER cara eu pagaria 50 pra assistir guardians of the galaxy pela primeira vez de novo|
|Sun Nov 23 22:42:23 +0000 2014|;|0|;|AT_USER qual é o modelo do seu eu quero um novo mas não gosto do galaxy e por incrível que pareça não sou fã de iphone|
|Sun Nov 23 22:32:18 +0000 2014|;|0|;|mês q vem to com o novo motog ou com o galaxy s4 to numa dúvida do crl |
|Sun Nov 23 21:09:14 +0000 2014|;|1|;|rt AT_USER novo vídeo demonstra mudanças do android 50 lollipop no samsung galaxy s5 URL|
|Sun Nov 23 21:08:09 +0000 2014|;|1|;|novo vídeo demonstra mudanças do android 50 lollipop no samsung galaxy s5 URL|
|Sun Nov 23 20:17:16 +0000 2014|;|0|;|preciso de um celular novo tipo urgente o meu é um galaxy s2 ele é bonzinho mas ultimamente tem travado muito stress já kk|
|Sun Nov 23 20:10:56 +0000 2014|;|0|;|tenho de comprar um móvel novo compro um apple ou um samsung galaxy |
|Sun Nov 23 19:28:09 +0000 2014|;|1|;|rt AT_USER desapegando ) URL|
|Sun Nov 23 19:27:24 +0000 2014|;|1|;|desapegando ) URL|
|Sun Nov 23 18:41:00 +0000 2014|;|1|;|rt AT_USER novo vídeo mostra mudanças do android 50 lollipop no samsung galaxy s5 URL|
|Sun Nov 23 18:40:01 +0000 2014|;|1|;|novo vídeo mostra mudanças do android 50 lollipop no samsung galaxy s5 URL|
|Sun Nov 23 18:28:42 +0000 2014|;|0|;|novo vídeo demonstra mudanças do android 50 lollipop no samsung galaxy s5 URL via AT_USER|
